rest_name,address,postal_code,latitude,longitude,opening,username,userid,user_location,user_rating,review_date,comment
Wheeler’s Estate,2 Park Lane Seletar Aerospace Park Singapore 798386 Singapore ,798386,1.40940356911653,103.86796885547,"[('Mon', ['Closed']), ('Tue', ['11:00 AM - 10:00 PM']), ('Wed', ['11:00 AM - 10:00 PM']), ('Thu', ['11:00 AM - 10:00 PM']), ('Fri', ['11:00 AM - 10:30 PM']), ('Sat', ['9:00 AM - 11:00 PM']), ('Sun', ['9:00 AM - 11:00 PM'])]",Jeannie L.,SzJ3Fcmj_qFTI5_JrMhZEw,"Singapore, Singapore",3,1/21/2017,"Ho hum food at the restored colonial buildings near Seletar airbase.Wheeler's Estate is one of four newly opened restaurants located at ""The Oval"", a set of restored colonial buildings formerly occupied by RAF servicemen who worked at the Seletar Airbase right up till 1971.Hipsters and instagrammers, rejoice. There is that ""cool"" atmosphere, with spacious surroundings, mood lighting and conservation buildings that hint of an era gone by. However the same cannot be said of the food...The menu is a little pricey, with the usual steaks, fish n chips and pastas. I went for the S$99 T-Bone and a grilled octopus starter, which I almost instantly regretted the minute it arrived on the table. It was plated immaculately, but was chewier than an eraser and definitely overcooked.The steak wasn't much better, rather bloodless and dry, without much flavor. It was placed on a gas grill (smelled of gas) and the sauces overpowered the steak. Perhaps I ordered the wrong menu items?For me, food quality comes first. I guess it's 4 stars for the atmosphere but 2 stars for the disappointing food. I'll most probably be back for a drink or dessert, but will definitely skip the food."
Wheeler’s Estate,2 Park Lane Seletar Aerospace Park Singapore 798386 Singapore ,798386,1.40940356911653,103.86796885547,"[('Mon', ['Closed']), ('Tue', ['11:00 AM - 10:00 PM']), ('Wed', ['11:00 AM - 10:00 PM']), ('Thu', ['11:00 AM - 10:00 PM']), ('Fri', ['11:00 AM - 10:30 PM']), ('Sat', ['9:00 AM - 11:00 PM']), ('Sun', ['9:00 AM - 11:00 PM'])]",Travel M.,kKzv6PG0p_lsEDFtwyJepA,"Singapore, Singapore",2,6/9/2018,The food and service were decent but the ambience at night was more like a wet market.  There was live music but the restaurant was had music which was rather annoying.  It was very crowded with lots of groups dinner.  While we were put in a quieter area it was still a noisy place for date night.   We wouldn't be coming back for dinner anytime soon.
TSP Coffee,1 Pemimpin Drive #01-02 Singapore 576151 Singapore ,576151,1.35183041148573,103.84291652646,"[('Mon', ['8:30 AM - 5:00 PM']), ('Tue', ['8:30 AM - 8:30 PM']), ('Wed', ['1:00 PM - 8:30 PM']), ('Thu', ['8:30 AM - 8:30 PM']), ('Fri', ['8:30 AM - 8:30 PM']), ('Sat', ['8:30 AM - 3:00 PM']), ('Sun', ['Closed'])]",Sajid B.,lcdV4nTZEEWxT5-CLb7OQQ,"Sunnyvale, CA",5,5/16/2019,"This is a hidden gem in the Thomson and Upper Thomson area, tucked away near the Clover Park and Thomson Rise neighborhoods. Bright and happy casual ambience. Just had a perfect breakfast of toast and eggs washed down with a delicious cup of coffee. All served tastefully and lovingly with real cutlery and crockery ! Scrambled eggs were warm and moist and savored with toast and generous just right amount of butter. Friendly people and smiles all round. Great music playing softly in the background so conversations are actually possible with a good friend. Kudos to Anne and the staff here for creating such a pleasant space. Limited menu but executed to perfection."
TSP Coffee,1 Pemimpin Drive #01-02 Singapore 576151 Singapore ,576151,1.35183041148573,103.84291652646,"[('Mon', ['8:30 AM - 5:00 PM']), ('Tue', ['8:30 AM - 8:30 PM']), ('Wed', ['1:00 PM - 8:30 PM']), ('Thu', ['8:30 AM - 8:30 PM']), ('Fri', ['8:30 AM - 8:30 PM']), ('Sat', ['8:30 AM - 3:00 PM']), ('Sun', ['Closed'])]",Shirley T.,elaLkfhrp_1O5kDA7ssuwA,"Singapore, Singapore",3,8/6/2020,"Great ambience and place to chill right in the midst of Pemimpin housing estate. I wouldn't have known of this if not for a friend who lives close by. Post COVID-19, I met my university mates to catch up during one of our birthdays. Foodwise, they had all day breakfasts, lunch and dinner menus. The staff were nice and friendly. I ordered the chicken and mash as recommended by the staff as one of their popular mains, which I found to be a tad too salty but the mash potato was nice and creamy, balancing the saltiness of the chicken chop. Lunch set comes with iced tea for $1 so that's a good deal. The bread pudding was pretty good too."
Cornerstone,"1380 Ang Mo Kio Ave 1, Bishan Park 2 Singapore 569930 Singapore ",569930,1.36259141424422,103.84709861014,[],Paul N.,3KYixk4HwDBFFBwws__tkw,"Singapore, Singapore",4,9/9/2017,"I'm happy to say, their pricing seems more reasonable now, mostly under $20, except their special dishes. Portion sizes are best described as healthy, aka smallish, but honestly, that's the healthy size we should be eating anyway. Preparation quality is good. I had the pulled pork salad. Seemed like a strange combination when I first saw it, but delightful. Best healthy dish I've  had in a while."
Cornerstone,"1380 Ang Mo Kio Ave 1, Bishan Park 2 Singapore 569930 Singapore ",569930,1.36259141424422,103.84709861014,[],Jim D.,i2G5mQrL1g_wgSuL8DGExQ,"Singapore, Singapore",4,1/10/2015,"Currently the only restaurant open on that side of Bishan Park, the others being closed until March for renovation, Cornerstone occupies an elevated position overlooking the car park at Bishan. They allow dogs in the outdoor area, which is a plus although the narrow layout means that you have to keep your dog under the table otherwise it can get in the way of servers and customers. We order a pulled pork sandwich and a burger. We ordered Erdinger which is available at Happy Hour prices up to 8pm. Service was friendly, although our server was a little wary of our ""big"" dog under the table. The service was also quick.  The pulled pork sandwich was a hit, with nice smoky flavor to the sauce. The burger was also very tasty with two small (OK, I confess to ordering the double) but thick patties. They were a little crumbly, but I was fine with this given the taste. Erdinger was the same as always. Despite a sitting outside, there was a nice breeze that kept the area cool. The canopy of greenery over that entire area should also mean that the place does not get too hot in daylight. All in all, a good experience and we would definitely return."
Cornerstone,"1380 Ang Mo Kio Ave 1, Bishan Park 2 Singapore 569930 Singapore ",569930,1.36259141424422,103.84709861014,[],Ancy N.,4y4obgWxi_CL25nRHrhuEA,"Singapore, Singapore",3,11/20/2012,"Great spot to be surrounded by the lush greenery of Bishan Park.The menu looks attractive enough for me to want to order more than one dish.Buffalo wings are yummy and they have up to 10 level of spiciness. Sour and tangy  and nicely fried. We only tried level 2. 6 wings go from $16. What I don't get is why does the price go up with the level of spiciness? Happy hour drinks till 7pm. Half pint draft erdinger for $6. There is tv screening soccer matches.Coffee is from Sg's home grown coffee roasters Nylon.Food is decent, and the space is nice. A nice spot to lounge in if you are in the area, but nothing to write home about."
Cornerstone,"1380 Ang Mo Kio Ave 1, Bishan Park 2 Singapore 569930 Singapore ",569930,1.36259141424422,103.84709861014,[],Wan Qi T.,O2itSY4F2jnPRXaxdVGOkQ,"Singapore, Singapore",2,1/7/2013,"My order of salmon pasta and sandwich tasted very very ordinary, and over priced.Entered the restaurant after looking at the weekend brunch menu displayed outside the restaurant on one Sunday afternoon, with a friend and his dog. Feeling excited to head in for some awesome brunch, the waiter told us to sit outside the restaurant (as we have a dog with us), and to my dismay, there was no brunch available - nothing that was being displayed before their entrance will be served. Must be kidding me, no brunch on a Sunday early afternoon. Ordered a salmon pasta which turned out really ordinary and paid $20 odd for it.I would sayyyy.. Next door serves really much better quality of food and the prices justifies the quality.Nay for me here."
Cornerstone,"1380 Ang Mo Kio Ave 1, Bishan Park 2 Singapore 569930 Singapore ",569930,1.36259141424422,103.84709861014,[],W D.,-B07E1F0tZ3HvgVdwJTj_A,"Singapore, Singapore",3,3/7/2015,"I've had lunch here twice.Overall, I think Cornerstone is inoffensive. And perhaps that is its biggest hurdle in standing out amongst the crowd. If there is one signature dish in the menu, I haven't found it.Buffalo wings were okay. For additional chilli heat, you have to add more money to the wings. I feel this choice of pricing is calculating. Generally, you'd find places with these sort of levels of heat, having an ultimate level, for which if you can finish the whole plate, you get the wings free. If it had that, I wouldn't take so much offense with the penny pinching pricing. I had a level five. It was hot enough for unpleasant things to leak from my nose. Your tolerance level may be greater.The batter for the fish and chips was great. Very light. A pretty high standard for Singapore I think, but if you've had fish and chips in Scotland, it pales. The fish was a tad smelly. It wasn't the freshest of frozen fish. They do not offer vinegar and salt as an option.Lamb rack was okay. Was not overdone. Still pink. But taste-wise it was just okay. My complaint with our lamb racks here is that we seem to have only mini-lamb suppliers, there's so little meat on them.Pork ribs is served with the sauce on the side, rather than brushed on the meat. On appearance it looks leathery dry and I think brushing on the sauce would make it more succulent, or at least appear so. However, the sauce is very salty and if spread all over the ribs it gets too cloying. For lack of a better way to put this, I think the sauce is lacking originality.Oxtail pasta was boring.On the two separate times, I had fellow diners who selected the set lunch. On one set lunch, the dessert was a tiny slice of banana cake that was actually quite pleasant. Banana cake normally has a heavy handed taste of essence of banana or whatever, but this one didn't seem to have it. It could be because it was such a small slice I couldn't tell.I find that there seems to be more effort made for the dessert. In the plating of the dessert, you can see thought and effort put in. It's a pity that the dessert station isn't right at the front, near the main entrance. I think there is something promising there, but not enough to inspire me to walk from my table to the far end of this not-very-large establishment.This review particularly hard to write because it's neither exceptionally bad or exceptionally good. And so while I think I can re-visit this place for a meal, it would just be an uneventful, rather unmemorable time. I'm not sure if the location or the price warrants going out of one's way to visit."
Cornerstone,"1380 Ang Mo Kio Ave 1, Bishan Park 2 Singapore 569930 Singapore ",569930,1.36259141424422,103.84709861014,[],Ah M.,56GdqYwlCqYhGDX8UJMyXw,"Penang, Malaysia",5,11/20/2015,"A weekend hangout dine in after your walk in the park. Wings are spectacularly spicy if you're up for the game at level 10. Good ambience, friendly and attentive service. Will return for more."
Cornerstone,"1380 Ang Mo Kio Ave 1, Bishan Park 2 Singapore 569930 Singapore ",569930,1.36259141424422,103.84709861014,[],J F.,8aBKh52ePGd3OG8di20wdw,"Singapore, Singapore",3,8/23/2012,"Places where you can have coffee and sit with your furry friends are few and far between. So it was with great pleasure that my girlfriend brought me out with her dog to check out Cornerstone, located at Bishan Park. As we both have goldies (her's is more properly behaved), she decided to give it a test to see how the place would hold up. The place is decently large and we chose an al fresco area (as usual). Space really isn't an issue, but the proximity to the nearby dog run means that your pet's attention will constantly be on the lookout. We thought that we could have a bite with her pet, but unfortunately, Cornerstone isn't a place that serves pets. It's just a restaurant that's pet friendly. Which isn't a bad thing. We've since been back at least once a month to spend some time with her dog (mine is too naughty too sit still), while having coffee and I have to see it's been a great find for us."
YUBA Hut,205 Hougang Street 21 #01-19/20 Singapore 530205 Singapore ,530205,1.3594966483839,103.885079918915,"[('Mon', ['10:00 AM - 10:00 PM']), ('Tue', ['10:00 AM - 10:00 PM']), ('Wed', ['10:00 AM - 10:00 PM']), ('Thu', ['10:00 AM - 10:00 PM']), ('Fri', ['10:00 AM - 10:00 PM']), ('Sat', ['10:00 AM - 10:00 PM']), ('Sun', ['10:00 AM - 10:00 PM'])]",Shirley T.,elaLkfhrp_1O5kDA7ssuwA,"Singapore, Singapore",4,10/15/2017,Can't believe this place existed right in the heartlands! Great food with great prizes. Unpretentious and low key. Japanese rice bowls prepared and cooked only upon ordering. The signature aburi salmon and beef steak don were both divine! As was the champion floss and mentaiko cheese sushi. I've had better sashimi but these were generous slices and good value for money.
YUBA Hut,205 Hougang Street 21 #01-19/20 Singapore 530205 Singapore ,530205,1.3594966483839,103.885079918915,"[('Mon', ['10:00 AM - 10:00 PM']), ('Tue', ['10:00 AM - 10:00 PM']), ('Wed', ['10:00 AM - 10:00 PM']), ('Thu', ['10:00 AM - 10:00 PM']), ('Fri', ['10:00 AM - 10:00 PM']), ('Sat', ['10:00 AM - 10:00 PM']), ('Sun', ['10:00 AM - 10:00 PM'])]",Gaik Ni Esther L.,aFXnLTwv-dWdbFC-2b-kdg,"Singapore, Singapore",4,10/4/2017,"I am impressed ... really ... I past by this place for more than hundred times but I never came in. Today I decided to have my quick dinner here... and I ordered Salmon Aburi Don which looks like their signature. It is not only looked exactly the same as photo, but it taste good. The price is $14.90, no gst no service charge. The portion is good for ladies, but maybe too small for men. I will come here again in future to try their unagi don... it is in between cold storage and subway ... not really can be seen from the main entrance."
Young’s Bar & Resturant,3 Hyde Park Gate The Oval Singapore 799531 Singapore ,799531,1.40711830667484,103.867607600386,"[('Mon', ['11:00 AM - 1:00 AM (Next day)']), ('Tue', ['11:00 AM - 1:00 AM (Next day)']), ('Wed', ['11:00 AM - 1:00 AM (Next day)']), ('Thu', ['11:00 AM - 1:00 AM (Next day)']), ('Fri', ['11:00 AM - 1:00 AM (Next day)']), ('Sat', ['8:00 AM - 2:00 AM (Next day)']), ('Sun', ['8:00 AM - 1:00 AM (Next day)'])]",Joscelyn T.,QjVcS8EylGWSeWJOz_aj_A,"Singapore, Singapore",3,1/16/2017,"Upon entry to the restaurant, Im abit turned off by the presence of houseflies on the table in front of me. But I asked for another table & the waitress did gave me another table.Food is ok, but not fantastic. Served hot. Drinks menu more extensive than food menu.Drinks selections wide variety : beer, wine, coffee etc Would come by this place for late night drinks as it's opened till 1am.To come by for food... I will reconsider again."
Young’s Bar & Resturant,3 Hyde Park Gate The Oval Singapore 799531 Singapore ,799531,1.40711830667484,103.867607600386,"[('Mon', ['11:00 AM - 1:00 AM (Next day)']), ('Tue', ['11:00 AM - 1:00 AM (Next day)']), ('Wed', ['11:00 AM - 1:00 AM (Next day)']), ('Thu', ['11:00 AM - 1:00 AM (Next day)']), ('Fri', ['11:00 AM - 1:00 AM (Next day)']), ('Sat', ['8:00 AM - 2:00 AM (Next day)']), ('Sun', ['8:00 AM - 1:00 AM (Next day)'])]",Simon M.,Gi4002ewrOxHzHvtp6H5mg,Hong Kong,1,5/1/2018,The mussels are humongous and not fresh. Ask for ketchup and it seems they have blended both chili together. It's terrible.
Swatow Seafood,181 Toa Payoh Lorong 4 #02-602 Singapore 310181 Singapore ,310181,1.33361936151806,103.850978678264,"[('Mon', ['8:00 AM - 10:30 PM']), ('Tue', ['8:00 AM - 10:30 PM']), ('Wed', ['8:00 AM - 10:30 PM']), ('Thu', ['8:00 AM - 10:30 PM']), ('Fri', ['8:00 AM - 10:30 PM']), ('Sat', ['8:00 AM - 10:30 PM']), ('Sun', ['8:00 AM - 10:30 PM'])]",Doreen T.,2F38Uc4UNNbFVdyUUnBjOA,"Singapore, Singapore",3,11/16/2015,"Swatow Restaurant is quite a popular with the older generation and it is well known for its teochew cuisine. On friday night, the restaurant also offers teochew opera show, which is quite rare to see these days. The restaurant is located opposite the library, on top of the supermarket. Although the building is quite old, there is a small lift to the restaurant which can fit 2 persons in it. This is great as a lot of people coming to this restaurant are quite old.The restaurant is decorated in quite the old school and no frill way, with traditional opera clothes at the entrance. As the restaurant is quite popular, it is best to make reservation before coming.Today the family is coming here for the hi-tea buffet which costs $22.80++ for an adult and $16.80++ for a child. Although the family have made reservation for hi-tea buffet which usually occurs from 3pm to 5pm, we have a rude shock when the staff tells us the last order for the buffet is 3.30pm. It seems that there is an event tonight. The restaurant will be closing the buffet earlier in order to prepare for the event. I am annoyed that the staff should have called up to tell us about the problem so that we could come earlier. The buffet style here is quite different from outside. There is no buffet counter or menu for one to look at. One just picks whatever one likes from the various push carts going around the dining room. Within a short time, the table is easily filled up.Kueh Pie Tee, Shark's Fin Soup and Duck meat roll are part of the buffet, but is limited to one serving per customer. The kueh pie tee is not filled with the traditional vegetable filling. Instead it is filled with calamari salad. Interesting.For the steamed dim sum, there is items such as xiao long bao, siew mai, bean curd roll, steamed pork ribs, crystal bun, chive dumplings, vegetable dumpling, seafood dumplings, chee cheong fan with assorted fillings and chicken feet. The crystal bun has savoury rice filling in it. Tastes not bad.For buns, there is cha siew bun (BBQ pork bun), pan fried pork bun, black sesame bun and everyone's favourite Liu Sha Bao (流沙包). The Liu Sha Bao (流沙包) is uniquely green in color, and the filling really flowing out easily. The black sesame filling in the black sesame bun is a bit too sweet for me.For deep fried items, there is shrimp roll, shrimp dumplings, seafood balls, goyza, and fried durian shrimp roll. The fried durian shrimp roll is covered with deep fried noodle like crust, inside filled with rich and chunky filling. Although one cannot smell the durian in it, the taste is pretty strong in it and surprisely well with the juicy shrimp.Besides these, there is also fried ee fu mee, century egg porridge, lotus leaf rice, chilled pork in jelly, chilled cheek in jelly, baked pork pastry, deep fried fish skin with salted egg and black sesame paste. The deep fried fish skin with salted egg sauce is quite nice with the mayonnaise, although I wish that the salted egg sauce could be thicker. The black sesame paste is quite rich and flavourful. Too bad that is the only hot dessert available that day.For cold desserts, there is ice jelly, almond jelly, herbal jelly and mango jelly. The herbal jelly tastes quite bitter. The ice jelly is quite refreshing with a hint of tea taste.Overall the food is not bad with quite a huge range although mother feels the various is less than the usual dim sum menu. Although there is a lot of staff running around, it is quite difficult to get their attention. Besides the hot tea served on the table, one can also help oneself to the ice lemon tea and ice cubes at the counter. Yes most of the times we seem to be helping ourselves to the various things around. Even when the staff has a push cart full of desserts in front of us and we request that we would like some, the old staff answers that it is not for us, but the tables behind us. Funny especially everyone is having the buffet too. The staffs here seem to be choosy in serving customers. Although at the end of the meal, one feels like having gone through a very fierce battle. Feeling super drain out."
Swatow Seafood,181 Toa Payoh Lorong 4 #02-602 Singapore 310181 Singapore ,310181,1.33361936151806,103.850978678264,"[('Mon', ['8:00 AM - 10:30 PM']), ('Tue', ['8:00 AM - 10:30 PM']), ('Wed', ['8:00 AM - 10:30 PM']), ('Thu', ['8:00 AM - 10:30 PM']), ('Fri', ['8:00 AM - 10:30 PM']), ('Sat', ['8:00 AM - 10:30 PM']), ('Sun', ['8:00 AM - 10:30 PM'])]",Jahan L.,mMjxhRn4h0LD1_jI3RT4cQ,"Bukit Timah, Singapore, Singapore",3,11/10/2015,"Had lunch at Swatow Seafood Restaurant in the heartland of Toa Payoh and i was pleasantly surprised.The old skool ambience of the place was really charming, with old skool ornate decorations at the reception. We ordered the prawn roe fried rice and it was really quite good. The different textures of prawn roe, crab meat and the vegetables created quite a stir in my mouth.We orderd the sharks head on the menu as it is quite an uncommon dish. It tasted really good but i felt really guilty for indulging in that dish with all the anti sharks fin campaign going around.The dim sum were good and overall it left me very satisfied. The prices are very reasonable and its alot cheaper than restaurants in town. I will definitely be back to sample the traditional Teochew dishes which I did not manage to taste this round."
Swatow Seafood,181 Toa Payoh Lorong 4 #02-602 Singapore 310181 Singapore ,310181,1.33361936151806,103.850978678264,"[('Mon', ['8:00 AM - 10:30 PM']), ('Tue', ['8:00 AM - 10:30 PM']), ('Wed', ['8:00 AM - 10:30 PM']), ('Thu', ['8:00 AM - 10:30 PM']), ('Fri', ['8:00 AM - 10:30 PM']), ('Sat', ['8:00 AM - 10:30 PM']), ('Sun', ['8:00 AM - 10:30 PM'])]",Kelly K.,tOnAuTqwPr5fwoVsXJ4s8A,"Singapore, Singapore",3,11/14/2015,"Old school would be the right words for it. And this is the kinda thing I like. I went on a weekday but I was made to understand that over the weekend, the place gets packed and there are still push carts for dim sum service. We ordered a fair bit and finished all that was placed before us :) Siew Mai is my usual ""standard setter"" for a dim Sum place and they did their quite well. And most of their item came in 3s so it it was just nice for the company that I was with. Both their fried and steams items were good. We finished off with a big bowl of steamed mushed up yam (o ni or however you spell it) and it was great! All round good experience."
Swatow Seafood,181 Toa Payoh Lorong 4 #02-602 Singapore 310181 Singapore ,310181,1.33361936151806,103.850978678264,"[('Mon', ['8:00 AM - 10:30 PM']), ('Tue', ['8:00 AM - 10:30 PM']), ('Wed', ['8:00 AM - 10:30 PM']), ('Thu', ['8:00 AM - 10:30 PM']), ('Fri', ['8:00 AM - 10:30 PM']), ('Sat', ['8:00 AM - 10:30 PM']), ('Sun', ['8:00 AM - 10:30 PM'])]",Jon L.,DvcAC_nlKaTDsHcA8Slagw,"San Francisco, CA",4,12/17/2013,"There are few things more amorous than the runny yoke of a just-poached egg cut open. The Liu Sha Bow at Swatow seafood comes a close second with its gooey filling just ready to spill out in all its sweet and savory goodness. You NEED to order it if you're here. Swatow Seafood is an unassuming dim sum place away from downtown which means reasonable prices, little to no wait (we had no wait at all on a Saturday afternoon), and the charm of the old school push-cart dim sum experience. This culminates into a very satisfying brunch experience with minimal stress so you can focus on enjoying the food. I thought everything we had was good from the standard siu mais and har gows to the century egg porridge and fried shrimp rolls. And of course end the meal with afore-mentioned Liu Sha Bow. The sweet custard is nicly balanced with the saltiness of the salted egg yolk. Such a treat!They have a buffet for high tea which looked like a great deal but our meal wasn't that much either which makes Sawtow Seafood a good value, and a tasty one at that,"
Swatow Seafood,181 Toa Payoh Lorong 4 #02-602 Singapore 310181 Singapore ,310181,1.33361936151806,103.850978678264,"[('Mon', ['8:00 AM - 10:30 PM']), ('Tue', ['8:00 AM - 10:30 PM']), ('Wed', ['8:00 AM - 10:30 PM']), ('Thu', ['8:00 AM - 10:30 PM']), ('Fri', ['8:00 AM - 10:30 PM']), ('Sat', ['8:00 AM - 10:30 PM']), ('Sun', ['8:00 AM - 10:30 PM'])]",Jessica G.,t5XN2Lmv_VeXRSw9YdGf_w,"Singapore, Singapore",2,8/23/2014,"Our first dinner here and ordered a few dishes. Essentially the food here is not bad (like the Braised Goose) but the price tag of the dishes is a tad too high for me to return. I can easily find similar tasty food in other restaurants that won't cost me an arm and leg. But having said that, this Swatow Restaurant has been around since way back so I guess they have their own following. Just not me in that queue then. Heh..."
