rest_name,address,postal_code,latitude,longitude,opening,username,userid,user_location,user_rating,review_date,comment
Soon Li Yong Tau Foo,"Blk 115, Bukit Merah View #01-78 Bukit Merah View Food Centre Singapore 151115 Singapore ",151115,1.28550445567433,103.821823256087,"[('Mon', ['12:00 PM - 3:00 AM (Next day)']), ('Tue', ['12:00 PM - 3:00 AM (Next day)']), ('Wed', ['12:00 PM - 3:00 AM (Next day)']), ('Thu', ['12:00 PM - 3:00 AM (Next day)']), ('Fri', ['12:00 PM - 3:00 AM (Next day)']), ('Sat', ['12:00 PM - 3:00 AM (Next day)']), ('Sun', ['12:00 PM - 3:00 AM (Next day)'])]",Gabriel S.,fBL9s_Cym7VJ3AY7Ioeaqw,"Newmarket, Canada",4,4/26/2017,"Coming to this Yong Tau Foo (random food items you can pick served with noodles and soup) place is certainly an interesting experience.For starters there's the opening time - midnight to 3am (even though this isn't near a nightlife place). However these times are not set in stone - we arrived at 12:30am and the food was only ready around 1am. The advantage of this timing is that the hawker centre is really empty - only a few random drink stalls were open, and only the one beside the yong tau foo seemed to be going at full steam.And then there's the confusing system of ordering - there's no guide for first-timers and the staff are a bit grumpy and assume everyone knows what the system is; it doesn't help that some of the information online (which I'd read to prepare for my visit) is wrong.As far as I can tell, the way the ordering system works is this: there're 2 queues. The first is on the right for you to select what items you want, and the second is on the left for you to send in your order. These queues work independently - so you should come with at least one other person so both of you can queue in either queue at the same time. Once it's the turn of the person in the left (order) queue, your order will be taken and you should say if you want noodles or bee hoon (or neither), if you want vegetables, if you want your order done dry or with soup (everyone had it dry so that's presumably better), if you want pork oil and if you want chili and/or sweet sauce (presumably only for dry orders). And don't block the exit to the stall because the lady will periodically emerge with huge steaming bowls and place them on a tray on the table outside the stall.There's a huge variety of ingredients here - the largest I've ever seen at a yong tau foo stall. And you don't find many elsewhere: pork belly, intestines, luncheon meat, squid, cuttlefish, stuffed mushrooms and your usual things (like lady's finger stuffed with fish paste).Their soup is quite spicy on the default setting, so you might want to ask for no added chili (it's even spicier than the chili sauce in noodles, since the man cuts chili padi into it)The pork oil, crispy lard, sweet and chili sauces all combine to explode in your mouth in a harmonious blend.At 1:30am the first queue had died and at 2:10am there were only two people in either queue. So if you can wait a bit it's better to come a bit later. And it's not like food will run out - some things which had run out were replenished even at 2am.This place could definitely use a process improvement consultant and more signs, but if you're hungry and in the area you could do worse than drop by."
Soon Li Yong Tau Foo,"Blk 115, Bukit Merah View #01-78 Bukit Merah View Food Centre Singapore 151115 Singapore ",151115,1.28550445567433,103.821823256087,"[('Mon', ['12:00 PM - 3:00 AM (Next day)']), ('Tue', ['12:00 PM - 3:00 AM (Next day)']), ('Wed', ['12:00 PM - 3:00 AM (Next day)']), ('Thu', ['12:00 PM - 3:00 AM (Next day)']), ('Fri', ['12:00 PM - 3:00 AM (Next day)']), ('Sat', ['12:00 PM - 3:00 AM (Next day)']), ('Sun', ['12:00 PM - 3:00 AM (Next day)'])]",Justin L.,MIJxM6okOagsLjPGP2C-Ug,"Singapore, Singapore",4,11/1/2012,"Soup base is sweat! Good variety for supper, cheap and generous"
Magic Square,7 Portsdown Rd Singapore 139298 Singapore ,139298,1.29358293201226,103.796061314936,"[('Mon', ['Closed']), ('Tue', ['6:00 PM - 8:00 PM', '8:15 PM - 10:15 PM']), ('Wed', ['6:00 PM - 8:00 PM', '8:15 PM - 10:15 PM']), ('Thu', ['6:00 PM - 8:00 PM', '8:15 PM - 10:15 PM']), ('Fri', ['6:00 PM - 8:00 PM', '8:15 PM - 10:15 PM']), ('Sat', ['6:00 PM - 8:00 PM', '8:15 PM - 10:15 PM']), ('Sun', ['Closed'])]",Nik T.,2jTqpqHAQnIzIfwHdaOiqQ,"Singapore, Singapore",4,10/31/2021,"not quite magical in my books yet.but i do like what they are trying to do here.will definitely support them as long as they can get their booking system working, without one hour glitches.kudos to them for the complimentary prosecco for the painful booking process some, like myself, had to endure.never been to their smaller old location just down across the road.this spanking new stand alone building with plentiful private parking right up front is definitely a good thing!lovely space within with great view of the open kitchen and lots of natural light coming through the full length windows also.i do like that they will not wait for you if you are late.if you are one of those tardy ones, you can only pick up from where the meal is at when you walk in.so don't be late!don't expect too much in terms of service.they might bring you a bottle of water and give you a first pour but the rest is up to you.the friendly vibes was good.a young team, promising.a menu that's showcasing local produce and flavours whilst injecting a complexity and finesse for the sharper, critical gourmet foodie tongues.some misses but mostly above par.we all need some magic in our lives and you can't really go wrong if you magically score a pair of seats to dine here!p.s. chef marcus' menu will be extended till end of november 2021."
Pontian Wanton Noodles,Star Vista 1 Vista Exchange Green Singapore 138617 Singapore ,138617,1.30681500712523,103.788462732266,[],Ka L.,uf1UdKswKWOqFLUvRvvbzA,"Singapore, Singapore",5,1/15/2016,"Yes yes yes, it's a chain, but it is a reliable chain with everything you're looking for: reasonably-priced food, consistently-good quality, speed and service.What can you get here? Kopitiam breakfast, local drinks, desserts and best of all, wanton mee! I love how the noodles are springy. The flavors of selection 5 is unbeatable. Spicy, sweet and a little tangy. And. Best of all, you can get all fried wantons!! Remember to get a scoop of mayonnaise to accompany the wantons! The soup is good too, not bland or full of MSG at other places. Turnover is really fast and during lunch time we sometimes have a communal table. A comfort food I crave, price is a little higher than hawker center but with the comfort of speed and air con, that's all worth it!!"
Pontian Wanton Noodles,Star Vista 1 Vista Exchange Green Singapore 138617 Singapore ,138617,1.30681500712523,103.788462732266,[],Sally T.,PsmyDRmom8mtBo0rOx0JwQ,"Novena, Singapore, Singapore",5,4/7/2018,"Located at B1 of the Star Vista, Pon Tian is super convenient for a quick tasty lunch after church service. Had the same Wan Ton noodles at different branches of Pon Tian, but none seems to have the same consistent quality at this branch. Love the combo sauce option which includes the dark sauce chili and tomato, extremely flavourful and coupled with delicious fried wan ton dipped in mayo!"
Pontian Wanton Noodles,Star Vista 1 Vista Exchange Green Singapore 138617 Singapore ,138617,1.30681500712523,103.788462732266,[],Melvon M.,sNIlFVDdsqpMTrjtG74_-Q,"San Jose, CA",4,3/17/2017,"Tasty and above average, but the portion is really small. The Char Siew is roasted right, tender and not too salty. We also have the Tau Suan dessert, a bit sweet and below average."
Pontian Wanton Noodles,Star Vista 1 Vista Exchange Green Singapore 138617 Singapore ,138617,1.30681500712523,103.788462732266,[],Ping L.,8Stq_lmhHw8Gt459P_4c7g,"Singapore, Singapore",5,5/1/2014,"Getting a good plate of wan tan mee in Singapore is pretty rare (compared to Penang style wan tan mee). Pontian makes up for this rarity. Their noodles are al dante, just the way it should be. Their sauce has the right amount of saltiness and they add plenty to coat all your noodles. For $4, you get a good amount of noodles with a few crispy wan tan AND a bowl of soup WITH more wan tans. This particular Pontian is located right across from Cold Storage in Star Vista. It has limited seatings but high turnover. It is a nice option if you want something quick and cheap. I highly recommend this place to wan tan mee lovers, especially those who have experienced Penang style wan tan mee."
Pontian Wanton Noodles,Star Vista 1 Vista Exchange Green Singapore 138617 Singapore ,138617,1.30681500712523,103.788462732266,[],Astrid G.,fj5bAcfeggkXUfwCMewI9Q,"Singapore, Singapore",4,8/22/2017,"I'd been craving a good plate of wan tan mee since returning from 4 years in the U.S., and I was unsure whether I'd be able to source a good one outside of Malaysia (where I was born). Well, Pontian to the rescue! It was a damn good bowl of chewy/al dente noodles, which I ordered with extra spice - only wish the wontons were steamed/boiled as opposed to fried. Will definitely return!"
Atout,40C Harding Rd Singapore 249548 Singapore ,249548,1.30589248213999,103.813619825518,"[('Mon', ['12:00 PM - 11:00 PM']), ('Tue', ['12:00 PM - 11:00 PM']), ('Wed', ['12:00 PM - 11:00 PM']), ('Thu', ['12:00 PM - 11:00 PM']), ('Fri', ['12:00 PM - 11:00 PM']), ('Sat', ['12:00 PM - 11:00 PM']), ('Sun', ['Closed'])]",John N.,xzzAr5EHYcuIGYO5jZk13w,"Plano, TX",5,5/20/2022,"Went to a business dinner here and was AMAZED.  Easily one of the top restaurants I've ever been to in the world.  Chef Patrick came out to discuss the menu and make recommendations before we ordered.  The dishes were served family style so I was able to try many different items and all were delicious.  The deserts were mini works of art and did not disappoint.  Not sure when I will be back in Singapore but rest assured, I will eat there when I am."
Atout,40C Harding Rd Singapore 249548 Singapore ,249548,1.30589248213999,103.813619825518,"[('Mon', ['12:00 PM - 11:00 PM']), ('Tue', ['12:00 PM - 11:00 PM']), ('Wed', ['12:00 PM - 11:00 PM']), ('Thu', ['12:00 PM - 11:00 PM']), ('Fri', ['12:00 PM - 11:00 PM']), ('Sat', ['12:00 PM - 11:00 PM']), ('Sun', ['Closed'])]",Eugenio F.,Nv_gr_ujHLRQ8_y0MjfKnw,"Singapore, Singapore",5,12/14/2018,"Great pate and rilettes!  ....as one would expect from the former Bistro Du Vin chef.  Everything we tried was tasty. The service was also great, got there on a Friday with no reservation and did their best to accommodate us, first inviting us at the bar upstairs for a drink and a small bite, as we were waiting for a table. Amazing! Will definitely be back."
Atout,40C Harding Rd Singapore 249548 Singapore ,249548,1.30589248213999,103.813619825518,"[('Mon', ['12:00 PM - 11:00 PM']), ('Tue', ['12:00 PM - 11:00 PM']), ('Wed', ['12:00 PM - 11:00 PM']), ('Thu', ['12:00 PM - 11:00 PM']), ('Fri', ['12:00 PM - 11:00 PM']), ('Sat', ['12:00 PM - 11:00 PM']), ('Sun', ['Closed'])]",Lam N.,Y4pO9yZociD96rtJ5vRyDw,"San Francisco, CA",4,8/9/2018,"Chef Patrick Heuberger has taken over the old Au Petit Salut, and he has lengthened and broadened the menu, and improved on the honest cooking. The food is very good and portions are generous, so a large group would gain by sharing appetisers. The charcuterie dishes (duck rillettes, pâté en croûte, beef tongue) are commendable, but the pig brain is really outstanding. Among the mains, the mustard rabbit is superb, and the stuffed quail is also scrumptious. Service is pleasant - chef Patrick regularly visits the dining room, and the French maître d' is very helpful in recommending dishes or unusual wines. The only bémol is the local staff - friendly but blurred. For instance, for our 'tah pow' they didn't pack the excellent sauce (there was an abundant amount left) and forgot to give it to us!"
Atout,40C Harding Rd Singapore 249548 Singapore ,249548,1.30589248213999,103.813619825518,"[('Mon', ['12:00 PM - 11:00 PM']), ('Tue', ['12:00 PM - 11:00 PM']), ('Wed', ['12:00 PM - 11:00 PM']), ('Thu', ['12:00 PM - 11:00 PM']), ('Fri', ['12:00 PM - 11:00 PM']), ('Sat', ['12:00 PM - 11:00 PM']), ('Sun', ['Closed'])]",Nik T.,2jTqpqHAQnIzIfwHdaOiqQ,"Singapore, Singapore",4,5/5/2018,"a tout i am not but touting them, i am!now, more about Ah-too?old location, new branding?new restaurant, veteran chef!for those who have dined at au petit slaut before, you will be very familiar with the layout here, perhaps a little more chillax now than before.menu is more varied but you will also notice a similar slant to it.they have been rather packed since their opening and that i think has stretched their service team to the brink of inadequate service.if you can bare with, slow..............service then your palates will be in for a treat!i would much rather have my bread basket filled with toasted bakes but they were good enough for the duck rillettes that i ordered as a starter and both were in fact good to eat even on it's own.a taste of the frothy lobster bisque with give you a cappuccinoess lightness contrasted with the depth of a strong, hearty, crustacean creamy base layer.the white asparagus, that will incur a supplement, fulfilled it's aphrodisiac role more than a gastronomical one.the main i had was a crispy black pudding and it transported me back to that very day in edinburgh when i first laid tongue on it!but now, to a much desired end result.gastronomical heaven in black and i'm definitely going back!it may not look like much but the perfect crisp gently peels away to reveal a soft, smooth, vulnerable, delectably minced mix.it's not gamey at all, no repulsion whatsoever, just pure attraction!simply seated on a bed of apple sauce to further tickle the palate.the oven roasted french chicken with 40 garlic came steaming hot in a claypot.just be careful not to burn your most valuable asset whilst eating!again, it does not look like much but the tenderness of it all will justify your decision to share this with another(only available for two pax).so maybe come in a bigger group and indulge.i'm not a big fan of tenderloin cut but if you must have your beef and eat it.pay the +$10 supplement and steak out!as it is a three course set lunch for $42++, be sure to pace yourself suitably for the sweet ending.in my case i had the truffle brie, not sweet but sweet!i guess they have to think about some crackers to accompany it?all you get is a singular slab of it.well, i don't really care to have any but am just used to all the condiments that come with my cheese plate most of the time i order one.otherwise, head straight for the super dark chocolate pot!it's 70% and a thick mousse in texture.there is a reason why it is their specialty!having cut his teeth elsewhere with various experts in their field, patrick has come back stronger and it shows in their food.i think his personable ways will be the trump card and further his chances of success with atout!"
