rest_name,address,postal_code,latitude,longitude,opening,username,userid,user_location,user_rating,review_date,comment
Peony Jade @ Keppel Club,10 Bukit Chermin Rd Singapore 109918 Singapore ,109918,1.26818174470199,103.811220361499,"[('Mon', ['6:00 AM - 10:30 PM']), ('Tue', ['6:00 AM - 10:30 PM']), ('Wed', ['6:00 AM - 10:30 PM']), ('Thu', ['6:00 AM - 10:30 PM']), ('Fri', ['6:00 AM - 10:30 PM']), ('Sat', ['6:00 AM - 11:00 PM']), ('Sun', ['6:00 AM - 11:00 PM'])]",San-Ju T.,ij3UcrQUXl7YBoBTcH89rQ,"Singapore, Singapore",5,8/11/2019,"Teapot soup double boiled conch consommé with black garlic - niceMarble Goby Soon Hock cooked 2 ways - fish is nice & fresh - Steamed with oyster sauce & black fungus - nice- Fried fish with bitter gourd, black beans, tang hoon (mung bean noodles) & vermicelli - very niceDeep fried prawns topped with bonito flakes & Japanese sesame sauce - watermelon base - niceChef Liew's Signature Roasted crispy chicken stuffed with glutinous rice & preserves meats (30 minutes preparation)- nice, glutinous rice is softMSW Durian mochi - Excellent! Super soft skin. Texture is better than Japanese mochi.Fried durian ice cream with avocado sauce - nice"
Peony Jade @ Keppel Club,10 Bukit Chermin Rd Singapore 109918 Singapore ,109918,1.26818174470199,103.811220361499,"[('Mon', ['6:00 AM - 10:30 PM']), ('Tue', ['6:00 AM - 10:30 PM']), ('Wed', ['6:00 AM - 10:30 PM']), ('Thu', ['6:00 AM - 10:30 PM']), ('Fri', ['6:00 AM - 10:30 PM']), ('Sat', ['6:00 AM - 11:00 PM']), ('Sun', ['6:00 AM - 11:00 PM'])]",Carolyn L.,Q1oMmm7tKPOzA7_gqcV4zg,"Vancouver, Canada",3,3/13/2020,"We came here to celebrate my father's birthday, and as it was still within the 15 days of Chinese New Year and covid-19, it was quite a strange experience. Half the restaurant was filled that night. We decided to try the a la carte buffet which included lobsters and some other premium items. I was not sure if it was because we had the buffet or what, but the dishes were not as good as usual.The sea cucumber dish was a disappointment. It looked and tasted strange. Not sure if this was the cause of stomach upset/diarrhea for the 3 of us who tried it. The others did not eat this. In any case, just do not order this dish in the buffet. Service was excellent though. I think it would be better to just order from the regular menu in future."
Peony Jade @ Keppel Club,10 Bukit Chermin Rd Singapore 109918 Singapore ,109918,1.26818174470199,103.811220361499,"[('Mon', ['6:00 AM - 10:30 PM']), ('Tue', ['6:00 AM - 10:30 PM']), ('Wed', ['6:00 AM - 10:30 PM']), ('Thu', ['6:00 AM - 10:30 PM']), ('Fri', ['6:00 AM - 10:30 PM']), ('Sat', ['6:00 AM - 11:00 PM']), ('Sun', ['6:00 AM - 11:00 PM'])]",Joe N.,2arW6KJ-BAoAfNrYC7zaPA,"Bukit Timah, Singapore, Singapore",3,3/20/2020,"""Ehhh..."" would be a tad dismissive,  but not far off.  I hate to be dismissive of honest efforts, yet there has to be verity in an opinion...especially one posted on Yelp!  The service was attentive enough even though the room was short-staffed for Sunday brunch during the Chinese New Year period...this was before the whole  coronavirus thing had bitten hard.  So bottom line, the wait team was trying, but just couldn't quite make it out of the weeds...and it stayed that way right through dim sum brunch.  The food was truly 3-star with some good ideas, but limited by quality and likely price point.  The dim sum was substantial, but didn't quite hit the mark when it came to texture and/or seasoning.   There were quite a few salty items and some of the steamed items were just this side of dry or rubbery.  The standout for me was a lightly deep-fried tofu dish dusted with Himalayan pink salt.  It was simple, showed restraint, and demonstrated an understanding and familiarity with each and every component of the dish.  I'm going to take a stab in the dark here and guess the food cost for really good salt and really good tofu came in under the unbending Limbo pole of a brunch budget at Peony Jade. So to sum it up, the brunch menu at Peony Jade had me going back for another bite...but not in a good way.  Each bite left me hanging a little, just shy of pleasingly sated. Great meals are less about more and almost always  about balance, which in Peony Jade's case was poignantly missing from the brunch menu."
Peony Jade @ Keppel Club,10 Bukit Chermin Rd Singapore 109918 Singapore ,109918,1.26818174470199,103.811220361499,"[('Mon', ['6:00 AM - 10:30 PM']), ('Tue', ['6:00 AM - 10:30 PM']), ('Wed', ['6:00 AM - 10:30 PM']), ('Thu', ['6:00 AM - 10:30 PM']), ('Fri', ['6:00 AM - 10:30 PM']), ('Sat', ['6:00 AM - 11:00 PM']), ('Sun', ['6:00 AM - 11:00 PM'])]",Gabriel S.,fBL9s_Cym7VJ3AY7Ioeaqw,"Newmarket, Canada",5,7/24/2016,"Recently, Peony Jade has received the Michelin Guide's Bib Gourmand award, offering ""exceptional good food at moderate prices"". Naturally, given Singaporeans' favourite past time of arguing about food, there has been a lot of controversy of this. So I thought it would be a good time to leave a review for this place (especially given that there's only 2 others, one each in 2015 and 2016 - I might as well fulfill the quota for 2016), which celebrates its 12th anniversary in the Keppel Club this year.In short, the award was deserved as most of the dishes are good or excellent, and the prices are quite reasonable (even before the credit card discount). Furthermore, this place doesn't just serve traditional Chinese food, but has subtle spins on it that adapt it to a modern sensibility. For example, there are animal shaped buns to appeal to the kids, and there are some Western ingredients and techniques (and no, not the usual foie gras that so many places rely on).The Rose-Infused Honey Glazed BBQ Pork was wonderful. Most char siew (BBQ Pork) is made with meat that is rather lean, leaving it rather dry and gaining more flavour from its sauce than its inherent characteristics. The BBQ pork here had lots of fat and so was really tender and succulent. The fragrant sauce worked in harmony with the meat rather than being the main deliverer of flavour to the dish. I didn't taste the rose, but I was still really happy with this.We also had Szechuan Style Tea Smoked Duck. This was pretty good, being crispy with a subtle tea taste. It was served with a hoisin-like sauce that was probably fermented bean sauce, as well as steamed buns. Not the usual serving method but some might appreciate the different take on the dish.The beef tenderloin cubes with scallions and premium sauce was possibly the best dish of all. The cut was pretty good, and could pass for good wagyu, with delicious fat and marbling. The sauce was fragrant and robust and the wok hei (kiss of the wok) was really great.The pork tenderloin with XO sauce and snow peas was not bad. The meat was tender and bouncy and the snow peas were remarkably clean-tasting (either due to freshness, not being over-fried or both).The stewed wintermelon with crabmeat and roe was alright. Nothing special, but a bit pricey due to the crab. So it is best avoided.The dry beef hor fun was very fragrant. The beef was tender and had bite, even though it was not primarily a beef dish. The noodles also had wok hei.We also had crispy youtiao roulette with king prawns. This dish is so awesome that I've ordered it on all 3 of my visits this year. The name is a bit of a misnomer because the very generous, fresh and flavourful prawn interior is surrounded by fried beancurd skin rather than youtiao (dough fritter). It is then wrapped with chee cheong fun (on the thick side) and served with a light soya sauce based sauce (the sort you usually find with dim sum chee cheong fun, not the breakfast vegetarian chee cheong fun thick sweet black sauce).On 2 previous visits we had sweet and sour sticky pork ribs. The sauce was better than that of the usual Emperor/King Pork Ribs - it was based on that standard flavour, but taken further and elaborated. Furthermore, they were sticky ribs - inspired by US-style ribs (instead of being wetter like Chinese style Emperor/King Pork Ribs are).We also had deep fried cod pieces in an edible basket tossed with dried chilis. This wasn't too bad - reasonably crispy and fresh. The chilis' flavour didn't really come through, which wasn't necessarily bad as our pre-schooler could eat the bits not buried in the dried chilis.The siu mai and soya sauce chicken were normal. On the other hand, the shredded duck salad (something you wouldn't find at virtually all other Chinese restaurants) was a bit uninspired. It didn't have much duck, and the salad dressing was boring. So no not everything here is very good, or even good."
Peony Jade @ Keppel Club,10 Bukit Chermin Rd Singapore 109918 Singapore ,109918,1.26818174470199,103.811220361499,"[('Mon', ['6:00 AM - 10:30 PM']), ('Tue', ['6:00 AM - 10:30 PM']), ('Wed', ['6:00 AM - 10:30 PM']), ('Thu', ['6:00 AM - 10:30 PM']), ('Fri', ['6:00 AM - 10:30 PM']), ('Sat', ['6:00 AM - 11:00 PM']), ('Sun', ['6:00 AM - 11:00 PM'])]",Jessica G.,t5XN2Lmv_VeXRSw9YdGf_w,"Singapore, Singapore",5,2/8/2015,Family had our CNY dinner here and my father-in-law ordered their set dinner. I must say that everything was lovely! The set menu included:1) Yu Sheng2) Shark's Fin Soup3) Steamed Fish in Soy Sauce4) Roasted Chicken5) Prawns in XO Sauce6) Broccoli with Abalone 7) Seafood Fried Rice8) Orh Nee & Nian Gao Service is great and the taste is incredible. It's Chinese cuisine on fine dining standards.
Peony Jade @ Keppel Club,10 Bukit Chermin Rd Singapore 109918 Singapore ,109918,1.26818174470199,103.811220361499,"[('Mon', ['6:00 AM - 10:30 PM']), ('Tue', ['6:00 AM - 10:30 PM']), ('Wed', ['6:00 AM - 10:30 PM']), ('Thu', ['6:00 AM - 10:30 PM']), ('Fri', ['6:00 AM - 10:30 PM']), ('Sat', ['6:00 AM - 11:00 PM']), ('Sun', ['6:00 AM - 11:00 PM'])]",Yelper Y.,D4LXF8rBJU__DAtiUVGDBg,"Houston, TX",3,12/30/2014,"Came here for dim sum and it was alright, nothing was that great or that bad. We ate til we were stuffed with the ala carte menu and had tea. The cost was around $90 for 2 people. The staff was not smiling but they were attentive and professional. We'll probably come back as they are close to us and the service was decent and cost not too bad."
The Bakery Chef,161 Bukit Merah Central #01-3711 Singapore 150161 Singapore ,150161,1.28391229397444,103.816006111441,[],Melissa Y.,H8mXfh5XgGCqmMLwVH7k5A,"Singapore, Singapore",5,5/18/2015,"I had been wanting to try out the rainbow cakes at The Bakery Chef for over a year now! And I finally got there! There's HDB parking at the nearby library, which is gantry operated.It is quite a small cafe, not a lot of seats, and they do not take reservations either. The cake display is so inviting! I had to order the $5.80 rainbow cake for sure and it did not disappoint! The bakery chef has started to sell waffles recently as well and I decided to try a non-conventional waffle with cotton candy!1. Rainbow cake $5.80The was moist, the layers were of even thickness and most of all! The butter cream on the top wasn't sweet. It was perfect. I loved it! I would totally get this again for sure!  I like that it is a petite size, so it's not too huge that you have to share it and also makes the price cheaper as well :D2. Berries Waffle $13.90The waffles came with cotton candy perched on a plastic stick that was ""planted"" into a cup of green tea powder on top of a cup of chocolate mousse. The waffles were very crispy and I loved it! They were generous with the fruits and I am won over by their crispy waffles.I also like that they have free wifi! The staff were friendly, but the shop is really cramped, and the tables are very close to each other. Nonetheless, if you are within the area, do check this out :D"
The Bakery Chef,161 Bukit Merah Central #01-3711 Singapore 150161 Singapore ,150161,1.28391229397444,103.816006111441,[],Brennan N.,YdW7DZzg7YCaxn5YUCarTA,"Singapore, Singapore",3,11/25/2015,"I had a chance to try out the Rainbow Cake. Not to shabby, it has sparing amount of nuts. My latte had a cute ""nyan-nyan"" cat, which I really liked as well. It's a pity that the electrical sockets were covered, so I had to proceed to the library nearby to work on my laptop.Oh! And for $10 you can get a Rainbow Cake, a Cuppa and a Macaron. Makes for a good tea, or a dessert after Lunch!"
The Bakery Chef,161 Bukit Merah Central #01-3711 Singapore 150161 Singapore ,150161,1.28391229397444,103.816006111441,[],Saskia C.,-pgoWr-O1psJ6LCFkGV6KQ,"Singapore, Singapore",3,6/1/2015,"With the radio in the background, you can easily feel like home in this comfy and hidden bakery. It's quite small (around 15 persons inside and 6 outside) but it worth definitely a good place in my ""where to sit down with my computer"" quest. I unfortunately didn't try their rainbow cake or waffles but I think it's a perfect excuse to come back."
The Bakery Chef,161 Bukit Merah Central #01-3711 Singapore 150161 Singapore ,150161,1.28391229397444,103.816006111441,[],Isnani I.,aUbs0HchxTaVBFR_cHdC9w,"Bedok North, Singapore, Singapore",4,9/27/2014,"Situated along the road near Bukit Merah Central, it's quite hard to miss this place when you're around that area. My colleagues and I decided to try out this one after reading some reviews on Instagram. We were instantly greeted by the friendly staffs upon arrival; probably because we were the first ones there. Haha! The cafe was soon filled by the time we got our order.I tried 2 different cakes -- Rainbow Cake and Chocolate Guanaja... The rainbow cake, nuh uh! Not so much. At least I have tasted better. But the chocolate cake, muah!! Me likey! They had many more pretty looking cakes which I wish I could have tried given the time.My colleagues tried their Apple Caramel Pancake and both their feedbacks were the same, ""The apples are too overwhelming!"" So well, I still would like to try more of their stuffs though. Overall, quite an experience."
The Bakery Chef,161 Bukit Merah Central #01-3711 Singapore 150161 Singapore ,150161,1.28391229397444,103.816006111441,[],Li T.,dJzKwp5k65MK3R_qn4Xpow,"Singapore, Singapore",3,2/13/2015,"I've heard quite a lot about the Bakery Chef ever since I came back from Tokyo but I've never got the motivation to head to the main shop. So it must be luck and fate that I chanced upon its pop-up stall at Orchard Central. The signature rainbow cake dutifully lived up to its reputation and exemplified all the essential qualities of a good sponge; moist and fluffy. There is even a tinge of citrus embedded in the layers. However, the cream was frosted unevenly and in short supply compared to the previous photos of rainbow cakes churned out from the same kitchen. The Chocolate Rainbow  ($5.50) turned out to be the better executed of the two as the ganache was velvety and the bottom sponge layers did not suffer from the ill fate of dehydration like the Rainbow Cake did. Most of the cakes assumed the same style and formula; squarish sponge cakes layered with cream. There isn't much excitement until I had the Matcha and Caramel Delight ($5.50 each), whose core is injected with red bean paste and salted caramel sauce respectively.Alas, something unpredicted amidst the predictabilities. In fact, both cakes surpassed the excellency of the predecessors with their unmistakable saturated sponge and little mounds of smoky piped cream. Nonetheless, these cakes were extremely delicate and I counted my blessings that little damage was inflicted by the heat when I transported them home. However, it was only until the Praline Delight ($6) when I started to see potential of this pastry shop. Chocolate mousse, hazelnut paste +crunch, sponge cake coated in chocolate ganache and nuts. It might not be the most original idea, but it's a classic combination done well. Simply look at how beautiful each layer has come together! This cake should deserve more credit and raving reviews than the mundane sponge cakes."
The Bakery Chef,161 Bukit Merah Central #01-3711 Singapore 150161 Singapore ,150161,1.28391229397444,103.816006111441,[],S T.,gRjk2PQoMQffOUdA8OzdBg,"Singapore, Singapore",4,5/24/2016,"One of the better dessert cafe in Singapore. Even though the cafe is located in a Neighbourhood area, it is flocking with lots of customer daily. Their dessert is amazing such that after you eat you would want to have another one. The atmosphere is great for relaxing or gathering with friends. However it is small and crowded most of the times. There are out door seating available too. But it gets hot outside. So I would recommend to go during off peak period. Must try their waffles as well as their cakes. Delicious. They do customer cake orders on their website. Really amazing cafe."
The Bakery Chef,161 Bukit Merah Central #01-3711 Singapore 150161 Singapore ,150161,1.28391229397444,103.816006111441,[],Natalie H.,SBVNVima7JWeA-6TXVvJbw,"Singapore, Singapore",4,6/18/2014,"I've tried about 8 cakes from this place and I've yet to find one I dislike.If you like rainbow cakes, this is the place to go. Instagram-worthy cakes here, at wallet-friendly prices, with good coffee (as reviewed by a colleague). My favorite has to be the red velvet cheesecake, although chocolate lovers will revel in the chocolate cake selection.Please do come here and support them. I think they are a nice small, cosy establishment with really good cakes that are worth every dollar."
The Bakery Chef,161 Bukit Merah Central #01-3711 Singapore 150161 Singapore ,150161,1.28391229397444,103.816006111441,[],Iris L.,AqKIqcqeoW8fJSjXB_H7hw,"Singapore, Singapore",5,3/10/2018,"Nice place to relax and enjoy a great slice of cake. Try many different kinds of cakes, waffles and brownies! it taste amazing! definitely worth to come! Bring a book and enjoy a day reading at the place. p.s the place is a little small but it's worth it!"
The Bakery Chef,161 Bukit Merah Central #01-3711 Singapore 150161 Singapore ,150161,1.28391229397444,103.816006111441,[],Weileng L.,1sU1q-fF-TGoFUUM6BVxIg,"Singapore, Singapore",4,1/5/2016,It has very nice chocolate fudge indulgence cake and carrot cake which are both like... Godzilla cakes due to their size! Lol! The carrot cake is really one of the best ones I have tried around town as it is not too sweet.
Farm & Fables,2 Science Park Dr #01-27 Ascent Singapore 118222 Singapore ,118222,1.29076149216193,103.784855036172,"[('Mon', ['11:30 AM - 2:30 PM', '5:00 PM - 9:30 PM']), ('Tue', ['11:30 AM - 2:30 PM', '5:00 PM - 9:30 PM']), ('Wed', ['11:30 AM - 2:30 PM', '5:00 PM - 9:30 PM']), ('Thu', ['11:30 AM - 2:30 PM', '5:00 PM - 9:30 PM']), ('Fri', ['11:30 AM - 2:30 PM', '5:00 PM - 9:30 PM']), ('Sat', ['11:30 AM - 2:30 PM', '5:00 PM - 9:30 PM']), ('Sun', ['Closed'])]",Doreen T.,2F38Uc4UNNbFVdyUUnBjOA,"Singapore, Singapore",4,9/10/2018,"Another restaurant on Burpple Beyond membership. Self service style. Order at counter. Pick up food at counter when buzzer rings. No GST or service charge. Help yourself to water at counter.Cioppino Fisherman's Stew (S$11.90)Yellowtail, Barramundi, Clams, Prawns, Tomatoes, Fennel, Pumpkin, RouilleOrdered this alone at first but it was not filling for a main. The seafood was quite juicy.Truffled Carbonara Spaghetti (S$11.90)Streaky Bacon, Fresh Mushroom Cream Sauce, Sous-vide EggSmell not bad of truffle. The sauce was quite rich and egg was cooked just right with the lava yolk flowing out.Portuguese Baked Rice (S$11.90)Sous-vide Chicken Breast, Mild Curry Veloute, Carrots, Onions, Mozzarella CheeseNice and cheesy rice with tender chicken meat.Australian Grain-Fed Beef Short Rib (S$18.90)220gram, Sauteed Garden Vegetables, Garlic Mashed Potatoes, Veal JusThe meat was quite tender. Like that the potatoes was soft and chucky. Showed that it was using real potatoes, not powdered version."
Morganfield’s,"1 Harbourfront Walk #01-51A, Vivocity Singapore 098585 Singapore ",098585,1.26434458658544,103.822476140505,"[('Mon', ['11:00 AM - 11:00 PM']), ('Tue', ['11:00 AM - 11:00 PM']), ('Wed', ['11:00 AM - 11:00 PM']), ('Thu', ['11:00 AM - 11:00 PM']), ('Fri', ['11:00 AM - 12:00 AM (Next day)']), ('Sat', ['11:00 AM - 12:00 AM (Next day)']), ('Sun', ['11:00 AM - 11:00 PM'])]",Iris L.,AqKIqcqeoW8fJSjXB_H7hw,"Singapore, Singapore",5,3/10/2018,Had the beer batter fish at Morgan field's knowing that they are good at meat I tried something different. Their fish is very crispy and not oily. Every bite has a crunch feeling. The lunch promotion is worth it as it comes with a soup ...
Morganfield’s,"1 Harbourfront Walk #01-51A, Vivocity Singapore 098585 Singapore ",098585,1.26434458658544,103.822476140505,"[('Mon', ['11:00 AM - 11:00 PM']), ('Tue', ['11:00 AM - 11:00 PM']), ('Wed', ['11:00 AM - 11:00 PM']), ('Thu', ['11:00 AM - 11:00 PM']), ('Fri', ['11:00 AM - 12:00 AM (Next day)']), ('Sat', ['11:00 AM - 12:00 AM (Next day)']), ('Sun', ['11:00 AM - 11:00 PM'])]",Doreen T.,2F38Uc4UNNbFVdyUUnBjOA,"Singapore, Singapore",4,8/23/2018,"Since it was weekday lunch time, I decided to get the top value lunch set which was available usually weekday from 11am to 3pm.Grilled Pork Chops (S$16.90++)BBQ glazed pork chop, tender & juicy, this is bound to make you salivate thinking about it. Served with Roasted Potatoes & Garden Salad.Came with a choice of drink and soup.The soup was potato soup. While savoury, there's barely any potato bits in it.For drink, selected ice lemon tea which was not too sweet.The meat was quite tender although felt that the BBQ sauce was a bit too overpowering. Serving was quite filling that one could not finish the potato and greens.Service was not bad , with the staff offering wet tissue at the end of the meal to clean up."
PeraMakan,"10 Bukit Chermin Rd Level 3, Keppel Club Singapore 109918 Singapore ",109918,1.26818174470199,103.811220361499,"[('Mon', ['11:30 AM - 3:00 PM', '6:00 PM - 10:00 PM']), ('Tue', ['11:30 AM - 3:00 PM', '6:00 PM - 10:00 PM']), ('Wed', ['11:30 AM - 3:00 PM', '6:00 PM - 10:00 PM']), ('Thu', ['11:30 AM - 3:00 PM', '6:00 PM - 10:00 PM']), ('Fri', ['11:30 AM - 3:00 PM', '6:00 PM - 10:00 PM']), ('Sat', ['11:30 AM - 3:00 PM', '6:00 PM - 10:00 PM']), ('Sun', ['11:30 AM - 3:00 PM', '6:00 PM - 10:00 PM'])]",Emilie A.,X-dEv3zNKXms9udkuiVcbw,"Fairfax, VA",4,10/16/2017,"The food was rather good here (the beef rendang is delicious and the meat is super tender) and the setting at the golf club is just beautiful. The service was rather slow, but it was a busy night. However, I was really impressed with one waitress. I had gotten a crispy piece of rice stuck in my teeth, and I was trying to discreetly push it out using my tongue. My host didn't even notice that I was trying to get out the piece of rice, but a waitress came over (without me having to ask) and gave me some toothpicks. I was super impressed with the fact that she noticed something so small and made the effort to make me more comfortable."
