rest_name,address,postal_code,latitude,longitude,opening,username,userid,user_location,user_rating,review_date,comment
PeraMakan,"10 Bukit Chermin Rd Level 3, Keppel Club Singapore 109918 Singapore ",109918,1.26818174470199,103.811220361499,"[('Mon', ['11:30 AM - 3:00 PM', '6:00 PM - 10:00 PM']), ('Tue', ['11:30 AM - 3:00 PM', '6:00 PM - 10:00 PM']), ('Wed', ['11:30 AM - 3:00 PM', '6:00 PM - 10:00 PM']), ('Thu', ['11:30 AM - 3:00 PM', '6:00 PM - 10:00 PM']), ('Fri', ['11:30 AM - 3:00 PM', '6:00 PM - 10:00 PM']), ('Sat', ['11:30 AM - 3:00 PM', '6:00 PM - 10:00 PM']), ('Sun', ['11:30 AM - 3:00 PM', '6:00 PM - 10:00 PM'])]",Wenxi C.,w91OgyE6GjOuZ_MtBk21uw,"Singapore, Singapore",4,4/4/2016,"Special Thanks to Colleague who had introduced this place for lunch. Never did i know that there is a hidden gem within the area of a country club. I always have the mindset that anything in the club is only exclusively for members and not the public but this is not the case.Talking about PeraMakan, it excites me as Peranakan Food is not commonly found and even if so it's only the few that we have been visiting.Starters for the Peranakan Cuisine is none other than their Ngoh Hiang. Meat with prawns were rolled and deeply fried. There were 3 rolls and they were all cut into 12 pieces, easiler to paired with the sweet sauce or a saucer filled with chilli, black sauce and Luak Chye.Nyonya Ngoh Hiang - $12I felt that Buah Keluak makes Peranakan Cuisine outstanding in the sense that I have not come across other cuisine making use of this Indonesian black nut as part of their dishes ingredient. Chicken was braised and soften among the richness of the black nut and Garam Assam Gravy. It might taste on a salty side if you are having just the dish alone without any plain rice. Do note that Steam Rice are served at $1 per head and refillable.For those who love Buah Keluak, each serving only comes with 2 nuts and special spoons were given to retrieve the flesh in the nuts.Ayam Buah Keluak - $16Braising in yummy tau cheo gravy, the dish was awesome. Pork belly was cooked with dried shitake mushrooms and winter bamboo shoots too. Presentation was dull in colors initially but was brightened up by the used of green chilli as garnishings.Babi Pongtay - $14The default order that cannot be skip during a Pernakan Cuisine! Simply loves its braised vegetables coupled with dried ingredients in bean sauce.Nyonya Chap Chye - $10The last to be served will be their red snapper fish head cooked in Nyonya Curry. Curry gravy was very appetizing indeed and makes a perfect pairing to the white rice. Assorted vegetables like egg plant, lady's finger and tomato among the items in the curry. Fish head was relatively fresh and was pleasing to the tastebuds.Nyonya Curry Fish Head - $28There can never be short of the taste of Gula Melaka here in their Chendol. Our desserts were shared among 5 of us and it was not a bad idea too. With freshly squeeze coconut milk over shaved ice with chendol strips and kidney beans, its all what you can find all in a bowl of chendol.Chendol - $5Buboh Cha Cha can be served either hot or cold, depending on your liking. The best thing is that freshly squeezed coconut milk was used and was good with yams, sweetpotatpes cubes that was steamed to its softened form, not forgettging my favourite tapioca jujubes!Buboh Cha Cha - $5Desserts for Durians lovers! Serve in a plate of 4. These choux pastry was filled with delicious D24 durian mousse. Taste was good but if they can come in chilled form, it would be perfect.Durian Puffs - $6Knowing that Peranakan dishes are never too easy to prepare and requires alot of perparation, they were always priced at a dearer side, that includes dining in PeraMakan. However, I find that the cuisine serve here is rather authentic and was not too commercialized like other places. However for parking, it may cost a bomb and you might want to take note."
PeraMakan,"10 Bukit Chermin Rd Level 3, Keppel Club Singapore 109918 Singapore ",109918,1.26818174470199,103.811220361499,"[('Mon', ['11:30 AM - 3:00 PM', '6:00 PM - 10:00 PM']), ('Tue', ['11:30 AM - 3:00 PM', '6:00 PM - 10:00 PM']), ('Wed', ['11:30 AM - 3:00 PM', '6:00 PM - 10:00 PM']), ('Thu', ['11:30 AM - 3:00 PM', '6:00 PM - 10:00 PM']), ('Fri', ['11:30 AM - 3:00 PM', '6:00 PM - 10:00 PM']), ('Sat', ['11:30 AM - 3:00 PM', '6:00 PM - 10:00 PM']), ('Sun', ['11:30 AM - 3:00 PM', '6:00 PM - 10:00 PM'])]",Ccy C.,nnrTscutHfdtbd1zs76gzw,"Bukit Timah, Singapore, Singapore",4,9/17/2019,Food is pretty good. Beef rendang and curry chicken is highly recommended. Chili kang Kong also a must try. Only if it is not so pricey  also like Keppel club for it's relax atmosphere. Will return for sure.
PeraMakan,"10 Bukit Chermin Rd Level 3, Keppel Club Singapore 109918 Singapore ",109918,1.26818174470199,103.811220361499,"[('Mon', ['11:30 AM - 3:00 PM', '6:00 PM - 10:00 PM']), ('Tue', ['11:30 AM - 3:00 PM', '6:00 PM - 10:00 PM']), ('Wed', ['11:30 AM - 3:00 PM', '6:00 PM - 10:00 PM']), ('Thu', ['11:30 AM - 3:00 PM', '6:00 PM - 10:00 PM']), ('Fri', ['11:30 AM - 3:00 PM', '6:00 PM - 10:00 PM']), ('Sat', ['11:30 AM - 3:00 PM', '6:00 PM - 10:00 PM']), ('Sun', ['11:30 AM - 3:00 PM', '6:00 PM - 10:00 PM'])]",Oh Trust Me -Ce L.,v0Rhk7rCqEzbW3iRv7rhkQ,"Anaheim, CA",2,10/7/2017,"Super expensive, but the staff is attentive and accommodating. The food just OK. Not worth the drive all the way out there."
PeraMakan,"10 Bukit Chermin Rd Level 3, Keppel Club Singapore 109918 Singapore ",109918,1.26818174470199,103.811220361499,"[('Mon', ['11:30 AM - 3:00 PM', '6:00 PM - 10:00 PM']), ('Tue', ['11:30 AM - 3:00 PM', '6:00 PM - 10:00 PM']), ('Wed', ['11:30 AM - 3:00 PM', '6:00 PM - 10:00 PM']), ('Thu', ['11:30 AM - 3:00 PM', '6:00 PM - 10:00 PM']), ('Fri', ['11:30 AM - 3:00 PM', '6:00 PM - 10:00 PM']), ('Sat', ['11:30 AM - 3:00 PM', '6:00 PM - 10:00 PM']), ('Sun', ['11:30 AM - 3:00 PM', '6:00 PM - 10:00 PM'])]",Marcus L.,vDCCEp_bOJ6kcyxZOfkedQ,"Singapore, Singapore",4,10/3/2013,"Is that a whole lamb shank, served on the bone? Why yes it is! Is the entire thing slathered in rendang sauce? Why yes it is!Is it amazingly delicious? Okay I can't keep up the cheerleading, but you bet it is!They have so many of your Nonya favourites, including one of my number one picks: chap chye. Okay lah, it's a cop out dish, but I REALLY like this one. And the otah's pretty good too. It comes in an oval dish, and it's chock full of fish meat and prawns - real ingredients! The free-flow rice doesn't hurt either, so eat your fill!Save a little room for dessert. The gula melaka sago is surprising! They've cleverly cooked the sago, and then let it set in little containers, and then popped it out when its cool, and voila! Sago in a jelly mould! A fun little touch. Dousing it all in gula melaka ain't bad."
PeraMakan,"10 Bukit Chermin Rd Level 3, Keppel Club Singapore 109918 Singapore ",109918,1.26818174470199,103.811220361499,"[('Mon', ['11:30 AM - 3:00 PM', '6:00 PM - 10:00 PM']), ('Tue', ['11:30 AM - 3:00 PM', '6:00 PM - 10:00 PM']), ('Wed', ['11:30 AM - 3:00 PM', '6:00 PM - 10:00 PM']), ('Thu', ['11:30 AM - 3:00 PM', '6:00 PM - 10:00 PM']), ('Fri', ['11:30 AM - 3:00 PM', '6:00 PM - 10:00 PM']), ('Sat', ['11:30 AM - 3:00 PM', '6:00 PM - 10:00 PM']), ('Sun', ['11:30 AM - 3:00 PM', '6:00 PM - 10:00 PM'])]",Candice A.,blxzOOhWwU_VtgVYxwL0AA,"Singapore, Singapore",3,7/12/2012,"This is the place we come to when we don't feel like competing for parking and the dinner crowd at Ivins. Food : IMO not as fantastic as Ivins but good enough. I guess PeraMakan is a bit more refined in its presentation and preparation but they don't have pong tauhu here, only bakwan kepiting and hee peow (fish maw) soup. The portions aren't as generous but I guess it's quite decent as well. I quite like the Nyonya chap chye and the udang masak kuah nanas (prawns in pineapple gravy) as well as the otak. Ambience : Family styled but also a place you can go to for business lunches. Makes sense since it's located in Keppel Club. Bring a jacket / shawl, air conditioning can get a bit chilly.Service : Quite decentDifficult to get out of here unless you drive. Taxi can take ages especially in the evenings."
PeraMakan,"10 Bukit Chermin Rd Level 3, Keppel Club Singapore 109918 Singapore ",109918,1.26818174470199,103.811220361499,"[('Mon', ['11:30 AM - 3:00 PM', '6:00 PM - 10:00 PM']), ('Tue', ['11:30 AM - 3:00 PM', '6:00 PM - 10:00 PM']), ('Wed', ['11:30 AM - 3:00 PM', '6:00 PM - 10:00 PM']), ('Thu', ['11:30 AM - 3:00 PM', '6:00 PM - 10:00 PM']), ('Fri', ['11:30 AM - 3:00 PM', '6:00 PM - 10:00 PM']), ('Sat', ['11:30 AM - 3:00 PM', '6:00 PM - 10:00 PM']), ('Sun', ['11:30 AM - 3:00 PM', '6:00 PM - 10:00 PM'])]",KC Y.,4a8FyxeKZNdaX1E8P7Os_g,"Redwood City, CA",4,12/1/2012,Very good. Peramakan is one of the best Peramakan places that I have ever tried in Singapore. The ayam buah Keluak is out of this world!
Donna Carmela,242 Pasir Panjang Rd Singapore 118597 Singapore ,117494,1.28051514672186,103.785443383155,[],Julian C.,-WShM_YFbtG4OcE0vrFVyw,"Singapore, Singapore",4,9/29/2012,"This place has a really great, intimate setting for a romantic dinner or anniversary celebration. And I would say that price-wise, it's not out of the reach of most people (even NUS students come here occasionally).I love the ravioli they dish out here, pair it with red or white wine. Particularly, choose the salmon cream sauce that I feel is the best of the lot. Other things to try on the menu are the Salmon carpaccio which helps kickstart your appetite nicely, and the carbonara."
Toast Box,"321 Alexandra Rd #01-17, Alexandra Central Singapore 159964 Singapore ",159964,1.28812220833697,103.799444839251,[],James P.,0XTNLVKxvFbYna7FiJtfHA,"Los Angeles, CA",5,11/16/2017,I always wanted try Toast Box - authentic toast set which comes with grain toast topped with pork powder and 2 eggs (20% cooked).  Another dish is laksa.  Laksa is like noodle soup based with coconut milk.  First time trying it and I love it.Also their coffee is very famous.  Very dark and rich taste.Toast Box satisfied my cravings in one visit. Toast Box in Singapore is a fast-food chain restaurant  specializes in toast and coffee.If you are not familiar with Toast Box..  need to try it.   Will not be disappointed.
Chili Padi Nonya Cafe,29 Heng Mui Keng Terrace #06-21 Singapore 119620 Singapore ,119620,1.29047597166212,103.777537789191,[],Kemlyn B.,9gZ4pQHdK6v8xMLig6EEFA,"Glendale, AZ",4,5/24/2019,"Quiet hospitality, tasty Peranakan food. During the 16th and 17th century, Chinese young men went to Singapore, Malaysia and Indonesia to find their fortune. They intermarried with non-Muslim women, birthing the Peranakan culture which has its own unique cuisine. One the of most unique ingredients they use in this food is the buah keluak or Pangium Edule seed. It is actually a poisonous seed that needs to be buried after harvesting to leach the toxins. However, the delicious, nutty, slightly bitter savory and soft flesh inside when cooked in a rich gravy is amazing. Chili Padi does a nice job picking, choosing good sized seeds that are not to old.The Ngoh Hiang or mined pork wrapped and deep fried in tofu skin also has a nice texture and is served with a slightly sweet sauce. Order the Bakwang Kepiting, a soup with meatballs. The broth is delicate and the meatballs, pretty good. I enjoyed eating it with their mild sambal belacan, chili sauce made with fermented shrimp and red chilies. Yum!The Chap Chye, braised mixed vegetables and Egg Foo Yong were okay, but not memorable.Desserts we tried included the Chendol and the Sago Pudding. Both were okay. If you have a sweet tooth, ask for extra Gula Melaka or palm sugar in syrup form.I enjoyed my experience at Chili Padi."
Chili Padi Nonya Cafe,29 Heng Mui Keng Terrace #06-21 Singapore 119620 Singapore ,119620,1.29047597166212,103.777537789191,[],Lu-Shien T.,dV2JKFQ1ezq8EuYLSJXFnw,"Newcastle, ME",2,7/6/2019,"What happened to the Ayam Buah Keluak???The nut meat which was velvety and nutty tasted like they were soaked in sugar water! Robbing me of the bitter, pungent, dark chocolate tang like experience. The prices are exorbitant,  and the portions small. So for the kitchen to screw up the headliner of the meal was deeply disappointing. I sulked away and pacified my frustration the next morning with a delightful Rawon from Bedok South."
Chili Padi Nonya Cafe,29 Heng Mui Keng Terrace #06-21 Singapore 119620 Singapore ,119620,1.29047597166212,103.777537789191,[],Natalie H.,SBVNVima7JWeA-6TXVvJbw,"Singapore, Singapore",3,11/25/2015,"For a $20 per person lunch buffet, there was a laksa station, kueh counter, kueh pie tee station and cooked food with dishes like rendang and pork belly buns. The quality of the food here is not very good, and I wouldn't come here specially for a buffet or lunch. Nothing was bad or very good, but service was prompt and it can accommodate about 100 people, which was why we had a corporate lunch here. You best call for a cab if you didn't drive. There aren't many taxis around this part of NUS!"
Chili Padi Nonya Cafe,29 Heng Mui Keng Terrace #06-21 Singapore 119620 Singapore ,119620,1.29047597166212,103.777537789191,[],Sonia C.,VlcYt8D7wGk8Bxb7lV3hzQ,"Geylang, Singapore, Singapore",1,2/19/2019,"will not bother to go if not for my friend who wanted to try nonya food.  The front server was so rude to us and practically said the price loud to us several times while rolling her eyes. As my friend was visiting, I was just going to leave it. Worst part was when I was taking food at the buffet line, another server push me aside to grab the dish plate. As I was talking to my friend about it, the same server came by with her cart and knocked into my chair without apologising. Food was way too salty and not authentic as described. Don't waste money and time, go somewhere else. PS: their laksa fish cake and chendol coconut milk turned bad, it was sour and yet they still served it. there wasn't many people when we went there and I know the reason."
Chili Padi Nonya Cafe,29 Heng Mui Keng Terrace #06-21 Singapore 119620 Singapore ,119620,1.29047597166212,103.777537789191,[],David S.,Vf3DJncooLUHWYele0Cxrw,"San Francisco, CA",4,5/16/2014,"Yelp has no classification for the food of the culture of Peranakan.  What is it?  It's a bit of south east asia.  It's a bit Malay.  It's a bit Chinese.  It's totally Singapore.  And here, it's in buffet form.  What I liked about this buffet is it's DIY (Do it yourself).  Many of the dishes are there in their elements and you put it together.  Laksa, MeeSaim, BBQ meat buns.  All off it there to adjust to your spice and taste level and it's a bit fresher than sitting out in a normal buffet line.  Course you can't complain to the chef if you don't like it because you kinda made it.  What I thought was fun was experimenting and making my own Peranakan fusions (like putting the stewed beef inside the steamed buns).  Fun indeed."
The Daily Cut,1 Fusionopolis Pl #01-28 Singapore 138522 Singapore ,138522,1.29986251400969,103.788101008299,[],Ting Yi C.,xU3sDPonLx1_w4t6wOOpdg,"Singapore, Singapore",4,2/10/2017,"I like this place for the convenience and healthy options. The portions are good and it could last me till late dinner. If you're looking to eat something healthy and clean, this is the place for you. Though I would say that it is a little pricey for salad bowls."
The Daily Cut,1 Fusionopolis Pl #01-28 Singapore 138522 Singapore ,138522,1.29986251400969,103.788101008299,[],Dmitriy V.,wDwwazbzYP7iUjV6DYgyKA,"Bayfront, Singapore, Singapore",4,6/24/2016,"As someone who is usually skeptical of salads being a meal, this is one of my favorite salad places!! For the basic salad you can choose one protein, one complex carb and 3 additions (unfortunately extra charge for avocado) but they are pretty generous with their portions. The few knocks against them is that their protein is really inconsistent. One day the steak is perfect and the next it can be rare cooked with a lot of fat. I have found that the less crowded they are, and the further away you are from their opening hour (11) the more likely you are to get quality. Otherwise this place is healthy and fills me up unlike most salad lunch places!"
The Daily Cut,1 Fusionopolis Pl #01-28 Singapore 138522 Singapore ,138522,1.29986251400969,103.788101008299,[],Joy A.,OTx8lNo-62V2rmAKkvAb1A,"Singapore, Singapore",4,11/23/2015,"Delicious and filling. I'm not much of a salad person since it usually makes me hungry fast, but The Daily Cut offers options like quinoa and sweet potato that are filling. The protein options are plenty and the portion is big. The dressings taste good too, and you can take as much as you want. When I feel like eating healthy I usually go here. So far I have not been disappointed."
Bread Yard,1 Fusionopolis Pl #01-23/24 Singapore 138632 Singapore ,138632,1.2995985718601,103.787640882653,"[('Mon', ['8:00 AM - 8:00 PM']), ('Tue', ['8:00 AM - 8:00 PM']), ('Wed', ['8:00 AM - 8:00 PM']), ('Thu', ['8:00 AM - 8:00 PM']), ('Fri', ['8:00 AM - 8:00 PM']), ('Sat', ['9:00 AM - 3:00 PM']), ('Sun', ['Closed'])]",Anchisa P.,GvGrSl1MoDlJrFamOGObEw,"Singapore, Singapore",4,12/31/2018,"Brunch / breakfast place in Fusionopolis. Dishes here come with egg and bread - you can choose to customize what you want in the plate or choose one of the many delicious pre-designed options. The food here tastes simple, healthy and good. Would definitely recommend if you are looking for brunch / all-day-breakfast in the area."
Bread Yard,1 Fusionopolis Pl #01-23/24 Singapore 138632 Singapore ,138632,1.2995985718601,103.787640882653,"[('Mon', ['8:00 AM - 8:00 PM']), ('Tue', ['8:00 AM - 8:00 PM']), ('Wed', ['8:00 AM - 8:00 PM']), ('Thu', ['8:00 AM - 8:00 PM']), ('Fri', ['8:00 AM - 8:00 PM']), ('Sat', ['9:00 AM - 3:00 PM']), ('Sun', ['Closed'])]",Melissa Y.,H8mXfh5XgGCqmMLwVH7k5A,"Singapore, Singapore",3,12/29/2015,"I love this place simply for the fact that they make their own bread! As you walk in on your right, you see massive glass doors that lead into the kitchen. They have huge mixer bowls and all sorts of fancy, commercial grade baking equipment.They sell their bread too, you can buy half a loaf for $4-5 or a whole loaf for $8.They have free wifi, water, and baking magazines to browse through. You order at the counter and for sandwich items, you pick them up at the collection counter when your buzzer rings. For breakfast platters and other non-sandwich items, the staff will serve the food to you. Everything on their menu is nett priced and sounds and looks delicious!1. Smoked Chicken Sandwich $8Sandwiched in a very crispy country bread, are smoked chicken slices, long beans, mustard and melted cheese. The exterior of the bread is almost biscuit like and it does take some jaw muscle to bite in. The chicken slices are breast meat sort of, with the mustard and gooey melted cheese. The chicken tasted so good! The smoked flavour wasn't very evident, mostly covered up by the mustard. The long beans provided as crunch in the sandwich as well as the ""green"" for the sandwich."
Bread Yard,1 Fusionopolis Pl #01-23/24 Singapore 138632 Singapore ,138632,1.2995985718601,103.787640882653,"[('Mon', ['8:00 AM - 8:00 PM']), ('Tue', ['8:00 AM - 8:00 PM']), ('Wed', ['8:00 AM - 8:00 PM']), ('Thu', ['8:00 AM - 8:00 PM']), ('Fri', ['8:00 AM - 8:00 PM']), ('Sat', ['9:00 AM - 3:00 PM']), ('Sun', ['Closed'])]",Wesley L.,i0x6MWNiFLQ2cV3aIVjO5g,"Wayne, PA",5,11/30/2015,"A hidden gem (can I still say this? It's getting less and less hidden by the week!) in the currently low traffic Galaxis. Prices are very reasonable, and the coffee, breads, pancakes and dessert are fantastic. The sandwiches are decent but not outstanding.The flat white in particular is executed skillfully, with a roast that isn't too acidic, topped off with smooth, creamy microfoam.The wife enjoyed the sweet pepper vegetarian sandwich while my toddler who's been having a bad week cheerily gobbled down the classic scrambled eggs on toast (rye bread).The butterscotch & berries pancakes were soft and fluffy (get this!), and we couldn't get enough of the banana coconut bread pudding with gula melaka caramel and vanilla ice cream (get this too!)Give the cookies a miss though - they were dry (we prefer soft and gooey) and were a tad too sweet."
Bread Yard,1 Fusionopolis Pl #01-23/24 Singapore 138632 Singapore ,138632,1.2995985718601,103.787640882653,"[('Mon', ['8:00 AM - 8:00 PM']), ('Tue', ['8:00 AM - 8:00 PM']), ('Wed', ['8:00 AM - 8:00 PM']), ('Thu', ['8:00 AM - 8:00 PM']), ('Fri', ['8:00 AM - 8:00 PM']), ('Sat', ['9:00 AM - 3:00 PM']), ('Sun', ['Closed'])]",Goh L.,O3u5ZjtLtuEtV6J-Bc5gdg,"Singapore, Singapore",5,9/9/2015,"The coffee here is pretty legendary. Its gentle flavor with a hint of nuttiness swaddles your tongue in warm dulcet tones, leaving you wanting more. Its the kind of coffee you'd want to being home to meet your parents, and they wouldn't even ask all the normal embarrassing questions because its personality is just that charming. And then you'd get married, it'd be a simple wedding, with just a few guests, and you'd wake up every morning wondering what you did to deserve such a good coffee. And then you'll have kids, and it'd be the cutest little cappuccino ever, and your life will be perfect. And then one day, you'll wake up in horror to find that you've drunk your little cappucino, brown stains still around your mouth as they drag you away to jail, kicking and screaming about how it was just one sip.Oh and the bread pudding is pretty great too. More like that girl whos kind of cute with the funky hair that youd hang out with a few times but overall not too bad either."
Bread Yard,1 Fusionopolis Pl #01-23/24 Singapore 138632 Singapore ,138632,1.2995985718601,103.787640882653,"[('Mon', ['8:00 AM - 8:00 PM']), ('Tue', ['8:00 AM - 8:00 PM']), ('Wed', ['8:00 AM - 8:00 PM']), ('Thu', ['8:00 AM - 8:00 PM']), ('Fri', ['8:00 AM - 8:00 PM']), ('Sat', ['9:00 AM - 3:00 PM']), ('Sun', ['Closed'])]",Terk C.,YSPpLYLxIqc_us_VvYybcw,"Singapore, Singapore",3,2/28/2017,"Wow this place is NOT good. Ive been using Yelp since 2010 especially when I moved to a new continent to help eliminate trial and error. It's not often that I get disappointed by highly rated yelp and this is one of them rare instances.We ordered the butterscotch & berries pancake and a Norwegian. The pancake was average and the Norwegian was a disappointment. For me salad (came w the Norwegian) isn't just a garnish, it's food. The cucumber was seeded (ok) and hard (not ok), the hollandaise sauce that came w the poached egg was not impressive (watery). The Hokkaido bread was quite ok. The smoked salmon was v average. The grilled asparagus on the other hand was really good. Unfortunately that's forms only 5-10% of the dish.The service was pretty good and people are Super friendly. Alight I'll bump them up to 3."
Bread Yard,1 Fusionopolis Pl #01-23/24 Singapore 138632 Singapore ,138632,1.2995985718601,103.787640882653,"[('Mon', ['8:00 AM - 8:00 PM']), ('Tue', ['8:00 AM - 8:00 PM']), ('Wed', ['8:00 AM - 8:00 PM']), ('Thu', ['8:00 AM - 8:00 PM']), ('Fri', ['8:00 AM - 8:00 PM']), ('Sat', ['9:00 AM - 3:00 PM']), ('Sun', ['Closed'])]",Li W.,MfJYydAMkqIjE2hfMZ7kmA,"New York, NY",4,8/5/2015,"The pancakes were an absolute delight! I don't typically enjoy pancakes because they tend to be too sweet for my liking, but I tried the maple syrup with bacon (forgot the name) and it was not too sweet and not too salty! The bacon was also one of best I've tried. The sandwich was pretty normal, but the pork belly sandwich was interesting - it's like a Chinese and western fusion. Pretty cool place, everyone working there seemed to be students, and I heard it's a relatively new place so many things were amateur eg paper plates and amateur waiters (we were asked to sit with a bunch of strangers on the same table before we hesitated and they gave us a table of our own). Not too expensive and the portion was alright."
Bread Yard,1 Fusionopolis Pl #01-23/24 Singapore 138632 Singapore ,138632,1.2995985718601,103.787640882653,"[('Mon', ['8:00 AM - 8:00 PM']), ('Tue', ['8:00 AM - 8:00 PM']), ('Wed', ['8:00 AM - 8:00 PM']), ('Thu', ['8:00 AM - 8:00 PM']), ('Fri', ['8:00 AM - 8:00 PM']), ('Sat', ['9:00 AM - 3:00 PM']), ('Sun', ['Closed'])]",Nik C.,qnXgtXUvHRn0L0_8SirnWw,"Singapore, Singapore",5,4/10/2016,"5-stars for the price for value at Bread Yard. You can construct your own Egg's Benny for under $10 ($6 for poached eggs with Hollandaise sauce + $2-3 for either back bacon or smoked salmon). I would say the bacon is a better bet than the salmon--the latter was a bit salty the last time I had it. Sandwiches are also passable, while the mashed potatoes with gravy were delicious! Home-brewed iced team should be skipped.Seating is often easy to come by, but the space is small. Bread Yard is tucked away inside one north, but it's a comfy place on a Sunday morning or afternoon. Take a walk around to catch a glimpse of the architectural work of the late Zaha Hadid!"
Bread Yard,1 Fusionopolis Pl #01-23/24 Singapore 138632 Singapore ,138632,1.2995985718601,103.787640882653,"[('Mon', ['8:00 AM - 8:00 PM']), ('Tue', ['8:00 AM - 8:00 PM']), ('Wed', ['8:00 AM - 8:00 PM']), ('Thu', ['8:00 AM - 8:00 PM']), ('Fri', ['8:00 AM - 8:00 PM']), ('Sat', ['9:00 AM - 3:00 PM']), ('Sun', ['Closed'])]",Janelle R.,owI_FQdAKZQFY8UnkQoD8g,"Los Angeles, CA",2,5/18/2018,"I really wanted to like this place, but sadness. My coffee was burnt and undrinkable. My croissantwich was dry and room temperature. The staff seems pleasant though."
