rest_name,address,postal_code,latitude,longitude,opening,username,userid,user_location,user_rating,review_date,comment
Swatow Seafood,181 Toa Payoh Lorong 4 #02-602 Singapore 310181 Singapore ,310181,1.33361936151806,103.850978678264,"[('Mon', ['8:00 AM - 10:30 PM']), ('Tue', ['8:00 AM - 10:30 PM']), ('Wed', ['8:00 AM - 10:30 PM']), ('Thu', ['8:00 AM - 10:30 PM']), ('Fri', ['8:00 AM - 10:30 PM']), ('Sat', ['8:00 AM - 10:30 PM']), ('Sun', ['8:00 AM - 10:30 PM'])]",Wilson T.,f-BMmGIbwmT_iCu7gJHZGA,"Singapore, Singapore",4,11/10/2013,"Don't be fool by the name (""seafood""). Swatow Seafood serves fantastic dim sum breakfast and brunches!Located in the heartlands of Singapore, this restaurant has been around for quite some time now. While the restaurant has not been advertising aggressively nor received the hype over some other star restaurant, it has been well patronised by those in-the-know. On weekends, this place is flooded with people, especially in the morning right up to noon. If you are coming as part of a large group, it is advisable to call ahead and make a reservation.While there has been a shift towards ""high end"" dim sum, i.e. ordering your dishes off a menu, Swatow Seafood still does it the ""old fashion"" way, i.e. service via a push cart. This is a nostalgic experience not to be missed (given that there isn't many such restaurants left). In addition to the old school experience, the dim sum served here is of a high standard comparable with many fine restaurants."
Swatow Seafood,181 Toa Payoh Lorong 4 #02-602 Singapore 310181 Singapore ,310181,1.33361936151806,103.850978678264,"[('Mon', ['8:00 AM - 10:30 PM']), ('Tue', ['8:00 AM - 10:30 PM']), ('Wed', ['8:00 AM - 10:30 PM']), ('Thu', ['8:00 AM - 10:30 PM']), ('Fri', ['8:00 AM - 10:30 PM']), ('Sat', ['8:00 AM - 10:30 PM']), ('Sun', ['8:00 AM - 10:30 PM'])]",Gaik Ni Esther L.,aFXnLTwv-dWdbFC-2b-kdg,"Singapore, Singapore",4,2/19/2017,"Went there with co-workers for Chinese New Year celebration. The service was okay, typical Chinese restaurant standard. The food wise, I love their steam crab very much. It's fresh. The fried oyster with egg is one of their signature, I like it. Will go there again with my family."
Swatow Seafood,181 Toa Payoh Lorong 4 #02-602 Singapore 310181 Singapore ,310181,1.33361936151806,103.850978678264,"[('Mon', ['8:00 AM - 10:30 PM']), ('Tue', ['8:00 AM - 10:30 PM']), ('Wed', ['8:00 AM - 10:30 PM']), ('Thu', ['8:00 AM - 10:30 PM']), ('Fri', ['8:00 AM - 10:30 PM']), ('Sat', ['8:00 AM - 10:30 PM']), ('Sun', ['8:00 AM - 10:30 PM'])]",Emily K.,6wGjjZkbAhcPnorLeh6INg,"Tucker, GA",2,8/9/2016,"What a disappointment! As a teochew nia, I expected a lot more of the teochew dishes in a restaurant like this. The chaipo kuayteow didn't have the wok hei I loved, and hardly had any chaipo! Sigh..."
Swatow Seafood,181 Toa Payoh Lorong 4 #02-602 Singapore 310181 Singapore ,310181,1.33361936151806,103.850978678264,"[('Mon', ['8:00 AM - 10:30 PM']), ('Tue', ['8:00 AM - 10:30 PM']), ('Wed', ['8:00 AM - 10:30 PM']), ('Thu', ['8:00 AM - 10:30 PM']), ('Fri', ['8:00 AM - 10:30 PM']), ('Sat', ['8:00 AM - 10:30 PM']), ('Sun', ['8:00 AM - 10:30 PM'])]",Tasha L.,81lTO98XYsDsUrJvD1maIA,"Hartville, OH",1,9/11/2019,"We ate there 2 years ago and we were very pleased with the service, price and food. However, we went today and was extremely disappointed. The price for buffet lunch was about $27 including tax. We have 2 hours tome span to eat starting from 3pm to 5pm, however, the food was not out for us until close to 4pm. We will told to pay even before we had food on the table. The varieties were limited, in fact, we were repeatedly asked if we have to eat the same dim sum. I have seated below and air conditioner and it was dripping water on my head. When I told them about it, server just said move your chair slightly to the right. The red been soup was so sweet, is like eating sugar. A lot of their dim sum were not made by kitchen, tasted like either frozen or mass production ordered from suppliers. There were chairs & tables stacked up at the narrow hallway going to toilet. This could be a fire hazard if it by the fire exit door. The elevator was not working at first and had to ask the staff to turn it back on so that my 97 years old dad can get up to restaurant. One waitress just took a plate of dim sum from our table without asking ask just to show the next table that the dish looked like. We were discussing what is their marketing strategy to attract customers. I think they started the dim sum late so we we only have an hour to eat and therefore, won't be able to consume more. And we were provided with limited varieties of dim sum to pick, therefore, we will get sick of the same dim sum with will not consume more. All in all, their strategy is to make more money and providing less, perhaps they are struggling to survive, who knows?!?!? We will not go back there again and will not recommend others to do so. We will also inform friends and relatives who thought they were good like we did, that the standards and quality has dropped. We went there with high expectations and what we got was sub standards in terms of quality, service, quantity and we certainly did not get we deserve with such high price range. I hope the management is made aware of this so that they can work on getting the restaurant back to where it was."
Swatow Seafood,181 Toa Payoh Lorong 4 #02-602 Singapore 310181 Singapore ,310181,1.33361936151806,103.850978678264,"[('Mon', ['8:00 AM - 10:30 PM']), ('Tue', ['8:00 AM - 10:30 PM']), ('Wed', ['8:00 AM - 10:30 PM']), ('Thu', ['8:00 AM - 10:30 PM']), ('Fri', ['8:00 AM - 10:30 PM']), ('Sat', ['8:00 AM - 10:30 PM']), ('Sun', ['8:00 AM - 10:30 PM'])]",Stephanie C.,_6zTmwRscQUpbyo8etB0nQ,"Singapore, Singapore",2,8/19/2012,My family went for the Swatow (which means Mountain Top in Teochew) Seafood Restaurant for the dim sum buffet. This place used to be Fortunate Restaurant and Lucky Restaurant before that.. so you can say it was a location where weddings and CNY reunion meals were held at when I was young. The only thing that remained the same were the toilet areas and those big curtains where they hide away the spare chairs and tables from public view. I remember playing hide and seek with my cousins there when I was young.. so it was really nostalgic. Anyway back to reviewing the food.. the way the dimsum buffet works is the trolley with piles of food and dimsum will be rolled away. Sounds reasonable but the problem lies with that. As this place is huge.. I personally feel that they are short handed.. so to the two dim sum trolleys that were going around.. it's like there's 30-40 tables waiting.. so sometimes when the trolley comes by.. it's nearly empty.. and the servers sometimes miss our table as we were seated in the middle. We noticed the chances of you getting your plate filled were higher if you were seated at the outside. Food came out one by one.. so we ended up spending a lot of time waiting for the trolleys to come by. Even the drinks were not properly organised.. if we didn't ask we wouldn't have known that we had to go to an area and get the drinks as the dim sum and the fried food were served by trolleys. Servings were depressing.. it's a buffet but the servers usually give us the exact headcount and said that she will come back again later if we should want a second helping since this is a buffet... but often the food runs out and we don't quite see the same food again. Food wise was so-so... I guess I only like the liu sha bao (salted egg yolk custard bun). That's about it.
Swatow Seafood,181 Toa Payoh Lorong 4 #02-602 Singapore 310181 Singapore ,310181,1.33361936151806,103.850978678264,"[('Mon', ['8:00 AM - 10:30 PM']), ('Tue', ['8:00 AM - 10:30 PM']), ('Wed', ['8:00 AM - 10:30 PM']), ('Thu', ['8:00 AM - 10:30 PM']), ('Fri', ['8:00 AM - 10:30 PM']), ('Sat', ['8:00 AM - 10:30 PM']), ('Sun', ['8:00 AM - 10:30 PM'])]",Jasmine H.,J6n308FUoKLLkwxNUH6a6w,"San Jose, CA",3,10/13/2013,The dim sum buffet is value for money. I wish they could change it to an ala carte system though
Swatow Seafood,181 Toa Payoh Lorong 4 #02-602 Singapore 310181 Singapore ,310181,1.33361936151806,103.850978678264,"[('Mon', ['8:00 AM - 10:30 PM']), ('Tue', ['8:00 AM - 10:30 PM']), ('Wed', ['8:00 AM - 10:30 PM']), ('Thu', ['8:00 AM - 10:30 PM']), ('Fri', ['8:00 AM - 10:30 PM']), ('Sat', ['8:00 AM - 10:30 PM']), ('Sun', ['8:00 AM - 10:30 PM'])]",Christine L.,1wWXchH7yRlFCxfC4dkQnA,"Singapore, Singapore",2,7/31/2012,"This is a JIU LOU. Not ninth floor. It means a proper Chinese restaurant where big dinners and feasts can be held, especially for weddings.It was also the place of my childhood.Or more accurately, the restaurant that used to be there, formed parts of my childhood. The previous tenant was Xin Fu Lou, which formed memories of piping-hot dim sum pushed around in trolleys.Swatow also has dim sum, but only in the day time and we were there for dinner.  The place was all white covers and folded napkins; sitting there I had an urge to give a $120 ang bao to a man and his wife.The Braised Slice Goose Meat in Teochew Style (~$17) was very savoury, especially the sauce. However the goose portion was too small, beneath the top few slices it was all tofu.The scallops and broccoli ($20) was fresh, but the portion was even smaller. Being hungry gluttons we ordered the oyster omelette ($8) from their Teochew Porridge just in case.Their signature Deep Fried Crispy Pig Trotter (~$25) is a must-try. The skin looked dark and the meat looked dark but it was GOOD. The skin was crispy and crunchy and yet easy on the bite. You know some crispy pork skin fried too hard until it tastes bitter and has so hard a centre it feels like biting on rocks? Not this. The meat was tender and flavourful. If you can only afford one dish, THIS IS IT. (Yes their dishes are pretty expensive IMO.)The oysters in the oyster omelette were huge and easy for me to pick out (I don't eat oysters) to give to my family members. The rest of it wasn't as starchy and gooey as I'd liked.A set of tea came with our dessert to clear our throats. I voiced out loud thinking it was syrup meant to be poured over the yam paste, asking why it wasn't poured. The affable head waiter corrected me, so yes, please don't embarrass yourself like me.I must also mention that Swatow refers to the Teochew province of China, and my heritage-proud father has claimed the food at Swatow to be quite authentically Teochew.Overall I feel the food is standard fare, and is overpriced; Swatow is evidently no Xin Fu Lou. I've heard good reviews about their dim sum buffets though."
WellSmoocht,"8 Sin Ming Road #01-03, Sin Ming Centre Singapore 575628 Singapore ",575628,1.35371665672148,103.836115880148,"[('Mon', ['12:00 PM - 9:00 PM']), ('Tue', ['12:00 PM - 9:00 PM']), ('Wed', ['12:00 PM - 9:00 PM']), ('Thu', ['12:00 PM - 9:00 PM']), ('Fri', ['12:00 PM - 9:00 PM']), ('Sat', ['12:00 PM - 9:00 PM']), ('Sun', ['12:00 PM - 9:00 PM'])]",Jessica H.,iFjKasqkx7shSFsYOgNG2g,"Melbourne, Australia",5,3/23/2017,"Loved this place. It has a cute, friendly vibe and absolutely delicious vegan desserts. Their ice cream is vegan, made from brown rice! They also do vegan pizzas and other Italian dishes here.I came here after dinner so was unfortunately already massively full, but I got myself a little scoop of chocolate hazelnut and it did not disappoint!I really just wish I'd had more time in Singapore to come back and try their vegan pizzas and other desserts, all of which looked incredible. Everything here is vegan, which is awesome. Staff is super friendly and they let me kick back and read a book at one of their comfy chairs long after I'd finished my ice cream.Even if you're just visiting Singapore as a tourist, if you're vegan or vegetarian or not able to eat dairy, it's definitely worth hopping on public transport to reach the Sin Ming Road area just to try this place. You will not be disappointed."
WellSmoocht,"8 Sin Ming Road #01-03, Sin Ming Centre Singapore 575628 Singapore ",575628,1.35371665672148,103.836115880148,"[('Mon', ['12:00 PM - 9:00 PM']), ('Tue', ['12:00 PM - 9:00 PM']), ('Wed', ['12:00 PM - 9:00 PM']), ('Thu', ['12:00 PM - 9:00 PM']), ('Fri', ['12:00 PM - 9:00 PM']), ('Sat', ['12:00 PM - 9:00 PM']), ('Sun', ['12:00 PM - 9:00 PM'])]",Tricia K.,RnK3QSPbf8ZOCTB7REY53w,"Eugene, OR",4,3/3/2020,"I was pretty excited about this awkwardly-named eatery when I saw their menu. Ended up with the Tempeh Partay (tasty), Suka Suka Jackfruit Bowl (healthy) and a double scoop of ice cream (dark chocolate and peanut butter, delicious!) - all vegan and gluten-free. Service was exceptionally friendly and accommodating. It was noisy with conversation as the small space was full on a Sunday afternoon. The heartbreaker for me was when I went to pay and found out they only take cash and NETS! I wish this had been noted on the door or menu - typically when dining at expensive brick-and-mortar places, I assume Visa and Mastercard will be accepted, saving me the trip to an ATM for cash withdrawal. Given that they're actually producing tasty, healthy vegan food with gluten-free options, I'm still giving it four stars, but for me personally, not accepting credit cards is a dealbreaker. The location is a bit off the beaten path. Still, if you have a NETS card or are not cash-averse, Wellsmoocht is worth checking out!"
WellSmoocht,"8 Sin Ming Road #01-03, Sin Ming Centre Singapore 575628 Singapore ",575628,1.35371665672148,103.836115880148,"[('Mon', ['12:00 PM - 9:00 PM']), ('Tue', ['12:00 PM - 9:00 PM']), ('Wed', ['12:00 PM - 9:00 PM']), ('Thu', ['12:00 PM - 9:00 PM']), ('Fri', ['12:00 PM - 9:00 PM']), ('Sat', ['12:00 PM - 9:00 PM']), ('Sun', ['12:00 PM - 9:00 PM'])]",Melissa Y.,H8mXfh5XgGCqmMLwVH7k5A,"Singapore, Singapore",4,10/24/2016,"Brownice Ice Cream is the first dessert place in Singapore to serve low-calorie, low-GI, low-fat, vegan-friendly and dairy-free ice cream made from organic brown rice. Guilt-free ice cream at it's best. Even though it's dairy-free, you should note that the ice cream does not taste icy at all, though it also lacks the creamy taste, Brownice ice cream still holds the smooth textures.The 4 scoops of ice cream we picked were :CoconutHazelnutMatchaPeanut ButterIt might sound like alot of flavours, but they all went well together. First off, if this is your first visit to Brownice, definitely go for the coconut! There's real coconut fruit embedded in the ice cream! It is slightly creamy, with authentic coconut taste and sweetness. It goes really well with the chocolate syrup topping.The matcha wasn't too bitter, and the sweetness level was just right for me. I don't like matcha ice creams that taste too sweet or artificial. Over here, the matcha was closer to the grainy texture, as unlike the coconut, the matcha wasn't able to have a smooth aftertaste. Nevertheless, probably the best guilt-free and vegan matcha you can taste in Singapore! The peanut butter was too sweet for my liking, but you could taste real peanut butter embedded into the ice cream. Think of chunky monkey from ben and jerrys. Lots of peanuts too, that adds a crunchy bite in every scoop!The hazelnut was almost like eating nutella ice cream! It was a tad sweet, and I probably wouldn't finish a whole scoop by myself, but give me a scoop of coconut or matcha, and it will magically disappear with a spoon in my hand.The waffle here is of a crispy consistency. I would say, this is one of my most favourite waffle places in Singapore. Despite the waffle not having any fragrance or aroma. The light, airy and yet biscuit like edges makes this waffle so addictive.Overall :  A great place to get vegan ice cream, even if you're not a vegan, or trying to stay on a healthy diet. The ice creams here are great, and so are their waffles. There's free wifi too! Definitely download the Entertainer App before heading down to Brownice!"
WellSmoocht,"8 Sin Ming Road #01-03, Sin Ming Centre Singapore 575628 Singapore ",575628,1.35371665672148,103.836115880148,"[('Mon', ['12:00 PM - 9:00 PM']), ('Tue', ['12:00 PM - 9:00 PM']), ('Wed', ['12:00 PM - 9:00 PM']), ('Thu', ['12:00 PM - 9:00 PM']), ('Fri', ['12:00 PM - 9:00 PM']), ('Sat', ['12:00 PM - 9:00 PM']), ('Sun', ['12:00 PM - 9:00 PM'])]",Catharina I.,9tliQ8H9xcGN8iVl55nx_g,"Zürich, Switzerland",4,1/13/2016,"I am the type of person who orders the meatlovers pizza with extra cheese and I love myself a glass of ice cold milk (don't even get me started about my milkshake fondness!). Meat and cheese are my favorite things to eat!Needless to say that when someone told me that we were going to a Vegan pizza and ice cream place I was not happy.I mean: pizza without meat and cheese? Ice cream without dairy? Me no likey! It sounded like a guaranteed one star review to me. But in the whole spirit of being open to others people opinions and tastes I tagged along, expecting to go to have a nice juicy burger and shake on my way back home. WRONG!!! This place is great and I liked the food a lot.Their pizza menu is quite extensive (much more options than the picture posted in a precious review) and since it was the four of us, we tried out 4 different ones and all of them were delicious, no kidding! Honestly, I really enjoyed it and I did not miss meat or cheese at all... Miracles do exist apparently!The crust of the pizza is the really thin and crispy and the toppings taste really fresh and unique...I really loved the ones with the monkey head mushrooms and as with regular pizza I especially enjoyed the ones with extra spice on it. In fact, the staff was nice enough to substitute and remove toppings to tailor my own personal pizza.I was not hungry anymore after all that pizza goodness but my friends wanted dessert and I by then, I was curious enough to taste the waffle and ice cream. The salted caramel vegan ice cream was delish! So I left Brownice feeling chock full and did not feel the need to eat any meat or anything at all that night.Would I return? Yes, with or without my vegan friends who introduced me to this great place."
WellSmoocht,"8 Sin Ming Road #01-03, Sin Ming Centre Singapore 575628 Singapore ",575628,1.35371665672148,103.836115880148,"[('Mon', ['12:00 PM - 9:00 PM']), ('Tue', ['12:00 PM - 9:00 PM']), ('Wed', ['12:00 PM - 9:00 PM']), ('Thu', ['12:00 PM - 9:00 PM']), ('Fri', ['12:00 PM - 9:00 PM']), ('Sat', ['12:00 PM - 9:00 PM']), ('Sun', ['12:00 PM - 9:00 PM'])]",Doreen T.,2F38Uc4UNNbFVdyUUnBjOA,"Singapore, Singapore",4,10/6/2015,"The outlet is located just off the main road of Upper Thomson and is within walking distance from the MRT station. The place is known for its vegan friendly food such as ice cream and pizza. It offers free wifi. What attracts me at the counter is the display of ice cream cakes, which I seldom see been sold as slices.I order 2 pieces which are been placed on a plate with some decorations on. So cute.Coconut-Gula Melaka ""Egg"" ($5.50/ mini)Coconut and gula melaka ice cream on digestive biscuit base. Delightly refreshing pairing.The ice cream is smooth with bits of the coconut flesh in it. It would be better if the flavour of the gula melaka has been stronger. The biscuit base gives it a slightly salty taste. Unique combination of the sweet and salty.Pure Hazelnut Bomb ($5.50/mini)Thick layer of hazenut ice cream on a fruit and nut chocolate base.The ice cream is very smooth and rich which kind of reminds me of peanut butter. Like this very much.Overall friendly staff with yummy desserts. There is also plain water and tissue to help yourself to at the side of the counter. Best of all the place is not crowded."
WellSmoocht,"8 Sin Ming Road #01-03, Sin Ming Centre Singapore 575628 Singapore ",575628,1.35371665672148,103.836115880148,"[('Mon', ['12:00 PM - 9:00 PM']), ('Tue', ['12:00 PM - 9:00 PM']), ('Wed', ['12:00 PM - 9:00 PM']), ('Thu', ['12:00 PM - 9:00 PM']), ('Fri', ['12:00 PM - 9:00 PM']), ('Sat', ['12:00 PM - 9:00 PM']), ('Sun', ['12:00 PM - 9:00 PM'])]",Natalie C.,FKWeca2cwUkxJTgW_Tj1nA,"Scottsdale, AZ",5,7/15/2013,"I have to give major props to this ice cream shop. Competition for ice cream is fierce in the Upper Thomson area, with 4 or 5 ice cream/waffle shops all within a 5 minutes walk from each other. However, this place stands out so nicely because its 100% vegan, and they don't use processed/refined sugar, only a small amount unrefined cane sugar in their waffles and cane juice in their ice cream. I asked :) Even their waffles are vegan, using no eggs or cows milk, and yet it was still delicious. I had 2 scoops of ice cream and a waffle, and by the end of finishing everything, I wasn't like super full or bloated, but I was definitely satisfied. Less guilt, and totally satisfied. That's a pretty good feeling coming out of an ice cream shop. The service is also THE NICEST I have come across in Singapore, shocking to say since this is an ice cream shop. All smiles and super sweet. They also serve free flow alkaline water with a high ph. I don't know any other ice cream shop, let alone restaurant that serves free flow alkaline water. Do you?!"
WellSmoocht,"8 Sin Ming Road #01-03, Sin Ming Centre Singapore 575628 Singapore ",575628,1.35371665672148,103.836115880148,"[('Mon', ['12:00 PM - 9:00 PM']), ('Tue', ['12:00 PM - 9:00 PM']), ('Wed', ['12:00 PM - 9:00 PM']), ('Thu', ['12:00 PM - 9:00 PM']), ('Fri', ['12:00 PM - 9:00 PM']), ('Sat', ['12:00 PM - 9:00 PM']), ('Sun', ['12:00 PM - 9:00 PM'])]",Felix H.,GidWIG7GSZHY7lGEi3d_UQ,"Singapore, Singapore",5,4/5/2015,The only vegan ice cream place in Singapore.The most important thing is that it taste delicious! I am lactose intolerant so their ice creams do me less harm.Now they have expanded into doing food like Pizzas and some cakes.The pizzas taste legit too so you might wanna give it a try. I find the taste pretty good as well. My vegan wife loves it!
WellSmoocht,"8 Sin Ming Road #01-03, Sin Ming Centre Singapore 575628 Singapore ",575628,1.35371665672148,103.836115880148,"[('Mon', ['12:00 PM - 9:00 PM']), ('Tue', ['12:00 PM - 9:00 PM']), ('Wed', ['12:00 PM - 9:00 PM']), ('Thu', ['12:00 PM - 9:00 PM']), ('Fri', ['12:00 PM - 9:00 PM']), ('Sat', ['12:00 PM - 9:00 PM']), ('Sun', ['12:00 PM - 9:00 PM'])]",Alex C.,1UZs_9wFHP4NR_62LwGD6g,"Singapore, Singapore",4,6/23/2014,"The Upper Thomson area has enjoyed popularity for offering  different F&amp;B choices. Ice cream parlours are no strangers here, with Salted Caramel, Udders, NeLi and Scoopz within the shophouses. One of the earliest tenants of the area, Brownice, is located further inwards, within Sin Ming Centre, which specializes in ice cream made from all natural, egg-free and non-dairy products.Satisfying my waffle cravings, I ordered the Waffles with Peanut Butter Chocolate ($7.30; $3.80 for waffles, $3.50 for 1 scoop). The waffles is crisp on the outside and moist on the inside. The Peanut Butter Chocolate accompanying it, while trying to strike a balance between both flavours, tasted more chocolatey than the peanut butter taste.Anyone can enjoy the ice cream here without feeling guilty due to the nature of the contents. If you are around the Sin Ming / Upper Thomson area, this is one spot that should not be missed."
WellSmoocht,"8 Sin Ming Road #01-03, Sin Ming Centre Singapore 575628 Singapore ",575628,1.35371665672148,103.836115880148,"[('Mon', ['12:00 PM - 9:00 PM']), ('Tue', ['12:00 PM - 9:00 PM']), ('Wed', ['12:00 PM - 9:00 PM']), ('Thu', ['12:00 PM - 9:00 PM']), ('Fri', ['12:00 PM - 9:00 PM']), ('Sat', ['12:00 PM - 9:00 PM']), ('Sun', ['12:00 PM - 9:00 PM'])]",Li T.,dJzKwp5k65MK3R_qn4Xpow,"Singapore, Singapore",2,2/14/2014,"Vegan food, vegan desserts and now......vegan ice cream. Brownice, a vegan ice cream parlor with a blue avatar, has kicked out a previous gourmet ice cream shop Ice Kimo at Sin Ming Centre. No dairy, no eggs, low fat, suitable for lactose-intolerant...These surely sounds like an attractive health contract. But the sweet treat is not necessarily a low-calorific indulgence. After all, unrefined sugar, nuts and brown rice are still usedTexture-wise, the ice-cream (two scoops for is not as smooth as most ice cream parlours including below320nitro. Luckily, both the Madagascar Vanilla and Cookies & Cream were not too sweet. Not too sure if coconut milk was used but there was an odd coconut aroma which lingers on.Don't mistake, I love coconut but perhaps I'll save it for other desserts.Constructed of French Chocolate, Hazelnut Chocolate ice cream and a raw crust, the tri-layer mudpie $9.80 refused to budge despite being left in room temperature for 20min. The ice cream flavours were more tolerable than the individual scoops earlier, and lovely contrasted with the salty biscuit base. The original toppings of caramelized salt almonds which ran out of stock, was a sign that they are likely to be tastier than our chocolate chips and granola. Due to the ingredients, the price of Brownice's vegan ice cream is not very nice. But perhaps its a good investment for our health."
